[Sat Dec 13 16:43:47 PST 2025] Starting SST-2 text baselines...
/users/sujinesh/.local/lib/python3.10/site-packages/transformers/utils/hub.py:128: FutureWarning: Using `TRANSFORMERS_CACHE` is deprecated and will be removed in v5 of Transformers. Use `HF_HOME` instead.
  warnings.warn(
Using GPU 0 (4 available): cuda:0
============================================================
SST-2 TEXT BASELINES
============================================================
Evaluating direct text classification (no bridge)
============================================================

Loading Mistral...
Downloading shards:   0%|          | 0/3 [00:00<?, ?it/s]Downloading shards: 100%|██████████| 3/3 [00:00<00:00, 4029.11it/s]
Loading checkpoint shards:   0%|          | 0/3 [00:00<?, ?it/s]Loading checkpoint shards:  33%|███▎      | 1/3 [00:00<00:00,  9.56it/s]Loading checkpoint shards: 100%|██████████| 3/3 [00:00<00:00, 13.93it/s]Loading checkpoint shards: 100%|██████████| 3/3 [00:00<00:00, 13.31it/s]

============================================================
SST-2 TEXT BASELINE
============================================================
SST-2:   0%|          | 0/200 [00:00<?, ?it/s]SST-2:   0%|          | 1/200 [00:00<01:29,  2.21it/s]SST-2:   1%|          | 2/200 [00:00<00:55,  3.60it/s]SST-2:   2%|▏         | 3/200 [00:00<00:46,  4.25it/s]SST-2:   2%|▏         | 4/200 [00:01<00:55,  3.52it/s]SST-2:   2%|▎         | 5/200 [00:01<00:56,  3.44it/s]SST-2:   3%|▎         | 6/200 [00:01<00:48,  4.02it/s]SST-2:   4%|▎         | 7/200 [00:01<00:42,  4.58it/s]SST-2:   4%|▍         | 8/200 [00:01<00:38,  5.03it/s]SST-2:   4%|▍         | 9/200 [00:02<00:35,  5.39it/s]SST-2:   6%|▌         | 11/200 [00:02<00:27,  6.80it/s]SST-2:   6%|▌         | 12/200 [00:02<00:28,  6.71it/s]SST-2:   6%|▋         | 13/200 [00:02<00:28,  6.62it/s]SST-2:   7%|▋         | 14/200 [00:02<00:28,  6.56it/s]SST-2:   8%|▊         | 16/200 [00:02<00:23,  7.68it/s]SST-2:   8%|▊         | 17/200 [00:03<00:25,  7.29it/s]SST-2:  10%|▉         | 19/200 [00:03<00:22,  8.13it/s]SST-2:  10%|█         | 20/200 [00:03<00:23,  7.67it/s]SST-2:  10%|█         | 21/200 [00:03<00:31,  5.70it/s]SST-2:  11%|█         | 22/200 [00:04<00:36,  4.84it/s]SST-2:  12%|█▏        | 23/200 [00:04<00:37,  4.69it/s]SST-2:  12%|█▏        | 24/200 [00:04<00:35,  4.93it/s]SST-2:  12%|█▎        | 25/200 [00:04<00:33,  5.27it/s]SST-2:  13%|█▎        | 26/200 [00:04<00:31,  5.56it/s]SST-2:  14%|█▎        | 27/200 [00:04<00:29,  5.78it/s]SST-2:  14%|█▍        | 28/200 [00:05<00:28,  5.93it/s]SST-2:  14%|█▍        | 29/200 [00:05<00:28,  6.06it/s]SST-2:  15%|█▌        | 30/200 [00:05<00:27,  6.17it/s]SST-2:  16%|█▌        | 31/200 [00:05<00:27,  6.25it/s]SST-2:  16%|█▋        | 33/200 [00:05<00:22,  7.50it/s]SST-2:  17%|█▋        | 34/200 [00:05<00:23,  7.20it/s]SST-2:  18%|█▊        | 36/200 [00:06<00:20,  8.09it/s]SST-2:  18%|█▊        | 37/200 [00:06<00:21,  7.61it/s]SST-2:  19%|█▉        | 38/200 [00:06<00:24,  6.59it/s]SST-2:  20%|█▉        | 39/200 [00:06<00:32,  5.01it/s]SST-2:  20%|██        | 40/200 [00:07<00:36,  4.43it/s]SST-2:  20%|██        | 41/200 [00:07<00:33,  4.78it/s]SST-2:  21%|██        | 42/200 [00:07<00:31,  5.03it/s]SST-2:  22%|██▏       | 43/200 [00:07<00:30,  5.22it/s]SST-2:  22%|██▏       | 44/200 [00:07<00:28,  5.52it/s]SST-2:  22%|██▎       | 45/200 [00:07<00:26,  5.75it/s]SST-2:  23%|██▎       | 46/200 [00:08<00:25,  5.93it/s]SST-2:  24%|██▎       | 47/200 [00:08<00:25,  6.06it/s]SST-2:  24%|██▍       | 48/200 [00:08<00:24,  6.16it/s]SST-2:  24%|██▍       | 49/200 [00:08<00:24,  6.24it/s]SST-2:  25%|██▌       | 50/200 [00:08<00:23,  6.28it/s]SST-2:  26%|██▌       | 51/200 [00:08<00:23,  6.33it/s]SST-2:  26%|██▌       | 52/200 [00:09<00:23,  6.34it/s]SST-2:  26%|██▋       | 53/200 [00:09<00:23,  6.25it/s]SST-2:  27%|██▋       | 54/200 [00:09<00:32,  4.45it/s]SST-2:  28%|██▊       | 55/200 [00:09<00:35,  4.05it/s]SST-2:  28%|██▊       | 56/200 [00:10<00:32,  4.49it/s]SST-2:  29%|██▉       | 58/200 [00:10<00:23,  5.98it/s]SST-2:  30%|██▉       | 59/200 [00:10<00:23,  6.08it/s]SST-2:  30%|███       | 61/200 [00:10<00:19,  7.22it/s]SST-2:  32%|███▏      | 63/200 [00:10<00:17,  8.00it/s]SST-2:  32%|███▎      | 65/200 [00:11<00:15,  8.55it/s]SST-2:  33%|███▎      | 66/200 [00:11<00:16,  8.01it/s]SST-2:  34%|███▎      | 67/200 [00:11<00:17,  7.52it/s]SST-2:  34%|███▍      | 68/200 [00:11<00:18,  7.22it/s]SST-2:  34%|███▍      | 69/200 [00:11<00:18,  6.99it/s]SST-2:  35%|███▌      | 70/200 [00:11<00:19,  6.82it/s]SST-2:  36%|███▌      | 71/200 [00:12<00:19,  6.70it/s]SST-2:  36%|███▌      | 72/200 [00:12<00:24,  5.12it/s]SST-2:  36%|███▋      | 73/200 [00:12<00:31,  4.08it/s]SST-2:  37%|███▋      | 74/200 [00:12<00:28,  4.49it/s]SST-2:  38%|███▊      | 75/200 [00:13<00:25,  4.92it/s]SST-2:  38%|███▊      | 76/200 [00:13<00:23,  5.28it/s]SST-2:  38%|███▊      | 77/200 [00:13<00:22,  5.56it/s]SST-2:  39%|███▉      | 78/200 [00:13<00:21,  5.79it/s]SST-2:  40%|███▉      | 79/200 [00:13<00:20,  5.96it/s]SST-2:  40%|████      | 80/200 [00:13<00:19,  6.09it/s]SST-2:  40%|████      | 81/200 [00:13<00:19,  6.18it/s]SST-2:  41%|████      | 82/200 [00:14<00:18,  6.25it/s]SST-2:  42%|████▏     | 83/200 [00:14<00:18,  6.29it/s]SST-2:  42%|████▏     | 84/200 [00:14<00:18,  6.29it/s]SST-2:  42%|████▎     | 85/200 [00:14<00:18,  6.31it/s]SST-2:  43%|████▎     | 86/200 [00:14<00:18,  6.33it/s]SST-2:  44%|████▎     | 87/200 [00:14<00:19,  5.88it/s]SST-2:  44%|████▍     | 88/200 [00:15<00:24,  4.49it/s]SST-2:  44%|████▍     | 89/200 [00:15<00:27,  4.08it/s]SST-2:  45%|████▌     | 90/200 [00:15<00:24,  4.51it/s]SST-2:  46%|████▌     | 91/200 [00:15<00:22,  4.95it/s]SST-2:  46%|████▌     | 92/200 [00:16<00:20,  5.31it/s]SST-2:  46%|████▋     | 93/200 [00:16<00:19,  5.58it/s]SST-2:  47%|████▋     | 94/200 [00:16<00:18,  5.80it/s]SST-2:  48%|████▊     | 95/200 [00:16<00:17,  5.96it/s]SST-2:  48%|████▊     | 96/200 [00:16<00:17,  6.08it/s]SST-2:  49%|████▉     | 98/200 [00:16<00:13,  7.37it/s]SST-2:  50%|█████     | 100/200 [00:17<00:12,  8.18it/s]SST-2:  50%|█████     | 101/200 [00:17<00:12,  7.72it/s]SST-2:  51%|█████     | 102/200 [00:17<00:13,  7.36it/s]SST-2:  52%|█████▏    | 103/200 [00:17<00:13,  7.08it/s]SST-2:  52%|█████▏    | 104/200 [00:17<00:15,  6.38it/s]SST-2:  52%|█████▎    | 105/200 [00:18<00:19,  4.79it/s]SST-2:  53%|█████▎    | 106/200 [00:18<00:21,  4.28it/s]SST-2:  54%|█████▎    | 107/200 [00:18<00:19,  4.66it/s]SST-2:  55%|█████▌    | 110/200 [00:18<00:12,  6.95it/s]SST-2:  56%|█████▌    | 111/200 [00:19<00:13,  6.57it/s]SST-2:  56%|█████▋    | 113/200 [00:19<00:12,  7.23it/s]SST-2:  57%|█████▋    | 114/200 [00:19<00:12,  7.03it/s]SST-2:  58%|█████▊    | 116/200 [00:19<00:10,  7.87it/s]SST-2:  58%|█████▊    | 117/200 [00:19<00:11,  7.49it/s]SST-2:  59%|█████▉    | 118/200 [00:19<00:11,  7.20it/s]SST-2:  60%|█████▉    | 119/200 [00:20<00:11,  6.98it/s]SST-2:  60%|██████    | 120/200 [00:20<00:11,  6.82it/s]SST-2:  60%|██████    | 121/200 [00:20<00:11,  6.70it/s]SST-2:  61%|██████    | 122/200 [00:20<00:12,  6.16it/s]SST-2:  62%|██████▏   | 123/200 [00:20<00:16,  4.65it/s]SST-2:  62%|██████▏   | 124/200 [00:21<00:18,  4.18it/s]SST-2:  62%|██████▎   | 125/200 [00:21<00:16,  4.60it/s]SST-2:  63%|██████▎   | 126/200 [00:21<00:14,  5.01it/s]SST-2:  64%|██████▍   | 129/200 [00:21<00:09,  7.36it/s]SST-2:  65%|██████▌   | 130/200 [00:21<00:09,  7.14it/s]SST-2:  66%|██████▌   | 131/200 [00:22<00:09,  6.95it/s]SST-2:  66%|██████▌   | 132/200 [00:22<00:09,  6.81it/s]SST-2:  66%|██████▋   | 133/200 [00:22<00:09,  6.70it/s]SST-2:  67%|██████▋   | 134/200 [00:22<00:09,  6.62it/s]SST-2:  68%|██████▊   | 135/200 [00:22<00:09,  6.56it/s]SST-2:  68%|██████▊   | 137/200 [00:22<00:08,  7.69it/s]SST-2:  69%|██████▉   | 138/200 [00:23<00:08,  7.34it/s]SST-2:  70%|██████▉   | 139/200 [00:23<00:08,  7.07it/s]SST-2:  70%|███████   | 140/200 [00:23<00:11,  5.34it/s]SST-2:  70%|███████   | 141/200 [00:23<00:12,  4.58it/s]SST-2:  71%|███████   | 142/200 [00:24<00:13,  4.45it/s]SST-2:  72%|███████▏  | 143/200 [00:24<00:11,  4.89it/s]SST-2:  72%|███████▏  | 144/200 [00:24<00:10,  5.25it/s]SST-2:  72%|███████▎  | 145/200 [00:24<00:09,  5.55it/s]SST-2:  74%|███████▎  | 147/200 [00:24<00:07,  6.92it/s]SST-2:  74%|███████▍  | 148/200 [00:24<00:07,  6.79it/s]SST-2:  74%|███████▍  | 149/200 [00:25<00:07,  6.69it/s]SST-2:  75%|███████▌  | 150/200 [00:25<00:09,  5.21it/s]SST-2:  76%|███████▌  | 151/200 [00:25<00:09,  5.17it/s]SST-2:  76%|███████▌  | 152/200 [00:25<00:08,  5.47it/s]SST-2:  76%|███████▋  | 153/200 [00:25<00:08,  5.72it/s]SST-2:  77%|███████▋  | 154/200 [00:26<00:07,  5.91it/s]SST-2:  78%|███████▊  | 155/200 [00:26<00:08,  5.38it/s]SST-2:  78%|███████▊  | 156/200 [00:26<00:10,  4.08it/s]SST-2:  78%|███████▊  | 157/200 [00:26<00:10,  4.12it/s]SST-2:  79%|███████▉  | 158/200 [00:27<00:09,  4.60it/s]SST-2:  80%|███████▉  | 159/200 [00:27<00:08,  5.02it/s]SST-2:  80%|████████  | 160/200 [00:27<00:07,  5.37it/s]SST-2:  80%|████████  | 161/200 [00:27<00:06,  5.65it/s]SST-2:  81%|████████  | 162/200 [00:27<00:06,  5.85it/s]SST-2:  82%|████████▏ | 163/200 [00:27<00:06,  6.02it/s]SST-2:  82%|████████▏ | 164/200 [00:28<00:05,  6.13it/s]SST-2:  82%|████████▎ | 165/200 [00:28<00:05,  6.19it/s]SST-2:  83%|████████▎ | 166/200 [00:28<00:05,  6.28it/s]SST-2:  84%|████████▎ | 167/200 [00:28<00:05,  6.35it/s]SST-2:  84%|████████▍ | 168/200 [00:28<00:05,  6.38it/s]SST-2:  84%|████████▍ | 169/200 [00:28<00:04,  6.41it/s]SST-2:  85%|████████▌ | 170/200 [00:28<00:04,  6.43it/s]SST-2:  86%|████████▌ | 171/200 [00:29<00:05,  4.92it/s]SST-2:  86%|████████▌ | 172/200 [00:29<00:06,  4.32it/s]SST-2:  86%|████████▋ | 173/200 [00:29<00:06,  4.30it/s]SST-2:  87%|████████▋ | 174/200 [00:29<00:05,  4.77it/s]SST-2:  88%|████████▊ | 175/200 [00:30<00:04,  5.16it/s]SST-2:  88%|████████▊ | 176/200 [00:30<00:04,  5.48it/s]SST-2:  88%|████████▊ | 177/200 [00:30<00:04,  5.73it/s]SST-2:  89%|████████▉ | 178/200 [00:30<00:03,  5.92it/s]SST-2:  90%|█████████ | 180/200 [00:30<00:02,  7.25it/s]SST-2:  90%|█████████ | 181/200 [00:30<00:02,  7.02it/s]SST-2:  92%|█████████▏| 183/200 [00:31<00:02,  7.93it/s]SST-2:  92%|█████████▏| 184/200 [00:31<00:02,  7.51it/s]SST-2:  92%|█████████▎| 185/200 [00:31<00:02,  7.21it/s]SST-2:  93%|█████████▎| 186/200 [00:31<00:02,  6.99it/s]SST-2:  94%|█████████▎| 187/200 [00:31<00:01,  6.72it/s]SST-2:  94%|█████████▍| 188/200 [00:32<00:02,  5.17it/s]SST-2:  94%|█████████▍| 189/200 [00:32<00:02,  4.11it/s]SST-2:  95%|█████████▌| 190/200 [00:32<00:02,  4.53it/s]SST-2:  96%|█████████▌| 191/200 [00:32<00:01,  4.95it/s]SST-2:  96%|█████████▌| 192/200 [00:32<00:01,  5.31it/s]SST-2:  96%|█████████▋| 193/200 [00:33<00:01,  5.60it/s]SST-2:  97%|█████████▋| 194/200 [00:33<00:01,  5.82it/s]SST-2:  98%|█████████▊| 195/200 [00:33<00:00,  5.98it/s]SST-2:  98%|█████████▊| 196/200 [00:33<00:00,  6.10it/s]SST-2:  98%|█████████▊| 197/200 [00:33<00:00,  6.19it/s]SST-2:  99%|█████████▉| 198/200 [00:33<00:00,  6.24it/s]SST-2: 100%|█████████▉| 199/200 [00:34<00:00,  6.28it/s]SST-2: 100%|██████████| 200/200 [00:34<00:00,  6.32it/s]SST-2: 100%|██████████| 200/200 [00:34<00:00,  5.85it/s]

SST-2 Text Baseline Accuracy: 88.5% (177/200)

Samples:
  Text: it 's a charming and often affecting journey . ... | GT: positive | Pred: positive. the text d
  Text: unflinchingly bleak and desperate ... | GT: negative | Pred: negative

explanatio
  Text: allows us to hope that nolan is poised to embark a... | GT: positive | Pred: positive. the text e
  Text: the acting , costumes , music , cinematography and... | GT: positive | Pred: positive. the text p
  Text: it 's slow -- very , very slow . ... | GT: negative | Pred: negative

explanatio

Loading Llama...
Downloading shards:   0%|          | 0/4 [00:00<?, ?it/s]Downloading shards: 100%|██████████| 4/4 [00:00<00:00, 4050.51it/s]
Loading checkpoint shards:   0%|          | 0/4 [00:00<?, ?it/s]Loading checkpoint shards:  25%|██▌       | 1/4 [00:00<00:00,  8.77it/s]Loading checkpoint shards:  75%|███████▌  | 3/4 [00:00<00:00, 13.36it/s]Loading checkpoint shards: 100%|██████████| 4/4 [00:00<00:00, 13.72it/s]

============================================================
SST-2 TEXT BASELINE
============================================================
SST-2:   0%|          | 0/200 [00:00<?, ?it/s]/users/sujinesh/.local/lib/python3.10/site-packages/transformers/generation/configuration_utils.py:590: UserWarning: `do_sample` is set to `False`. However, `temperature` is set to `0.6` -- this flag is only used in sample-based generation modes. You should set `do_sample=True` or unset `temperature`.
  warnings.warn(
/users/sujinesh/.local/lib/python3.10/site-packages/transformers/generation/configuration_utils.py:595: UserWarning: `do_sample` is set to `False`. However, `top_p` is set to `0.9` -- this flag is only used in sample-based generation modes. You should set `do_sample=True` or unset `top_p`.
  warnings.warn(
SST-2:   0%|          | 1/200 [00:00<00:26,  7.56it/s]SST-2:   1%|          | 2/200 [00:00<00:26,  7.44it/s]SST-2:   2%|▏         | 3/200 [00:00<00:27,  7.24it/s]SST-2:   2%|▏         | 4/200 [00:00<00:26,  7.44it/s]SST-2:   2%|▎         | 5/200 [00:00<00:25,  7.55it/s]SST-2:   3%|▎         | 6/200 [00:00<00:25,  7.58it/s]SST-2:   4%|▎         | 7/200 [00:00<00:25,  7.62it/s]SST-2:   4%|▍         | 8/200 [00:01<00:25,  7.67it/s]SST-2:   4%|▍         | 9/200 [00:01<00:24,  7.70it/s]SST-2:   5%|▌         | 10/200 [00:01<00:24,  7.71it/s]SST-2:   6%|▌         | 11/200 [00:01<00:24,  7.73it/s]SST-2:   6%|▌         | 12/200 [00:01<00:25,  7.49it/s]SST-2:   6%|▋         | 13/200 [00:01<00:33,  5.60it/s]SST-2:   7%|▋         | 14/200 [00:02<00:38,  4.85it/s]SST-2:   8%|▊         | 15/200 [00:02<00:38,  4.85it/s]SST-2:   8%|▊         | 16/200 [00:02<00:34,  5.40it/s]SST-2:   8%|▊         | 17/200 [00:02<00:30,  5.94it/s]SST-2:   9%|▉         | 18/200 [00:02<00:28,  6.39it/s]SST-2:  10%|▉         | 19/200 [00:02<00:26,  6.75it/s]SST-2:  10%|█         | 20/200 [00:02<00:25,  7.03it/s]SST-2:  10%|█         | 21/200 [00:03<00:24,  7.24it/s]SST-2:  11%|█         | 22/200 [00:03<00:24,  7.38it/s]SST-2:  12%|█▏        | 23/200 [00:03<00:23,  7.49it/s]SST-2:  12%|█▏        | 24/200 [00:03<00:23,  7.56it/s]SST-2:  12%|█▎        | 25/200 [00:03<00:22,  7.62it/s]SST-2:  13%|█▎        | 26/200 [00:03<00:22,  7.67it/s]SST-2:  14%|█▎        | 27/200 [00:03<00:22,  7.70it/s]SST-2:  14%|█▍        | 28/200 [00:04<00:22,  7.73it/s]SST-2:  14%|█▍        | 29/200 [00:04<00:22,  7.74it/s]SST-2:  15%|█▌        | 30/200 [00:04<00:21,  7.75it/s]SST-2:  16%|█▌        | 31/200 [00:04<00:22,  7.62it/s]SST-2:  16%|█▌        | 32/200 [00:04<00:29,  5.68it/s]SST-2:  16%|█▋        | 33/200 [00:04<00:34,  4.89it/s]SST-2:  17%|█▋        | 34/200 [00:05<00:34,  4.86it/s]SST-2:  18%|█▊        | 35/200 [00:05<00:30,  5.47it/s]SST-2:  18%|█▊        | 36/200 [00:05<00:27,  6.01it/s]SST-2:  18%|█▊        | 37/200 [00:05<00:25,  6.45it/s]SST-2:  19%|█▉        | 38/200 [00:05<00:23,  6.80it/s]SST-2:  20%|█▉        | 39/200 [00:05<00:22,  7.06it/s]SST-2:  20%|██        | 40/200 [00:05<00:22,  7.26it/s]SST-2:  20%|██        | 41/200 [00:06<00:21,  7.40it/s]SST-2:  21%|██        | 42/200 [00:06<00:21,  7.51it/s]SST-2:  22%|██▏       | 43/200 [00:06<00:20,  7.58it/s]SST-2:  22%|██▏       | 44/200 [00:06<00:20,  7.64it/s]SST-2:  22%|██▎       | 45/200 [00:06<00:20,  7.68it/s]SST-2:  23%|██▎       | 46/200 [00:06<00:19,  7.71it/s]SST-2:  24%|██▎       | 47/200 [00:06<00:19,  7.72it/s]SST-2:  24%|██▍       | 48/200 [00:06<00:19,  7.73it/s]SST-2:  24%|██▍       | 49/200 [00:07<00:19,  7.74it/s]SST-2:  25%|██▌       | 50/200 [00:07<00:19,  7.61it/s]SST-2:  26%|██▌       | 51/200 [00:07<00:26,  5.72it/s]SST-2:  26%|██▌       | 52/200 [00:07<00:30,  4.92it/s]SST-2:  26%|██▋       | 53/200 [00:08<00:30,  4.88it/s]SST-2:  27%|██▋       | 54/200 [00:08<00:26,  5.49it/s]SST-2:  28%|██▊       | 55/200 [00:08<00:24,  5.99it/s]SST-2:  28%|██▊       | 56/200 [00:08<00:22,  6.42it/s]SST-2:  28%|██▊       | 57/200 [00:08<00:21,  6.68it/s]SST-2:  29%|██▉       | 58/200 [00:08<00:21,  6.56it/s]SST-2:  30%|██▉       | 59/200 [00:08<00:21,  6.44it/s]SST-2:  30%|███       | 60/200 [00:09<00:22,  6.36it/s]SST-2:  30%|███       | 61/200 [00:09<00:21,  6.41it/s]SST-2:  31%|███       | 62/200 [00:09<00:20,  6.66it/s]SST-2:  32%|███▏      | 63/200 [00:09<00:19,  6.96it/s]SST-2:  32%|███▏      | 64/200 [00:09<00:18,  7.18it/s]SST-2:  32%|███▎      | 65/200 [00:09<00:18,  7.35it/s]SST-2:  33%|███▎      | 66/200 [00:09<00:17,  7.46it/s]SST-2:  34%|███▎      | 67/200 [00:09<00:17,  7.56it/s]SST-2:  34%|███▍      | 68/200 [00:10<00:19,  6.76it/s]SST-2:  34%|███▍      | 69/200 [00:10<00:25,  5.14it/s]SST-2:  35%|███▌      | 70/200 [00:10<00:28,  4.61it/s]SST-2:  36%|███▌      | 71/200 [00:10<00:25,  5.15it/s]SST-2:  36%|███▌      | 72/200 [00:10<00:22,  5.72it/s]SST-2:  36%|███▋      | 73/200 [00:11<00:20,  6.21it/s]SST-2:  37%|███▋      | 74/200 [00:11<00:19,  6.61it/s]SST-2:  38%|███▊      | 75/200 [00:11<00:18,  6.92it/s]SST-2:  38%|███▊      | 76/200 [00:11<00:17,  7.15it/s]SST-2:  38%|███▊      | 77/200 [00:11<00:16,  7.32it/s]SST-2:  39%|███▉      | 78/200 [00:11<00:16,  7.42it/s]SST-2:  40%|███▉      | 79/200 [00:11<00:16,  7.51it/s]SST-2:  40%|████      | 80/200 [00:12<00:15,  7.57it/s]SST-2:  40%|████      | 81/200 [00:12<00:15,  7.63it/s]SST-2:  41%|████      | 82/200 [00:12<00:15,  7.67it/s]SST-2:  42%|████▏     | 83/200 [00:12<00:15,  7.69it/s]SST-2:  42%|████▏     | 84/200 [00:12<00:15,  7.71it/s]SST-2:  42%|████▎     | 85/200 [00:12<00:14,  7.73it/s]SST-2:  43%|████▎     | 86/200 [00:12<00:14,  7.75it/s]SST-2:  44%|████▎     | 87/200 [00:12<00:17,  6.61it/s]SST-2:  44%|████▍     | 88/200 [00:13<00:21,  5.15it/s]SST-2:  44%|████▍     | 89/200 [00:13<00:24,  4.62it/s]SST-2:  45%|████▌     | 90/200 [00:13<00:21,  5.18it/s]SST-2:  46%|████▌     | 91/200 [00:13<00:18,  5.75it/s]SST-2:  46%|████▌     | 92/200 [00:13<00:17,  6.23it/s]SST-2:  46%|████▋     | 93/200 [00:14<00:16,  6.62it/s]SST-2:  47%|████▋     | 94/200 [00:14<00:15,  6.93it/s]SST-2:  48%|████▊     | 95/200 [00:14<00:14,  7.02it/s]SST-2:  48%|████▊     | 96/200 [00:14<00:19,  5.35it/s]SST-2:  48%|████▊     | 97/200 [00:14<00:18,  5.57it/s]SST-2:  49%|████▉     | 98/200 [00:14<00:16,  6.08it/s]SST-2:  50%|████▉     | 99/200 [00:15<00:15,  6.51it/s]SST-2:  50%|█████     | 100/200 [00:15<00:14,  6.84it/s]SST-2:  50%|█████     | 101/200 [00:15<00:13,  7.09it/s]SST-2:  51%|█████     | 102/200 [00:15<00:13,  7.28it/s]SST-2:  52%|█████▏    | 103/200 [00:15<00:13,  7.41it/s]SST-2:  52%|█████▏    | 104/200 [00:15<00:13,  7.09it/s]SST-2:  52%|█████▎    | 105/200 [00:15<00:17,  5.58it/s]SST-2:  53%|█████▎    | 106/200 [00:16<00:19,  4.85it/s]SST-2:  54%|█████▎    | 107/200 [00:16<00:19,  4.83it/s]SST-2:  54%|█████▍    | 108/200 [00:16<00:16,  5.45it/s]SST-2:  55%|█████▍    | 109/200 [00:16<00:15,  5.98it/s]SST-2:  55%|█████▌    | 110/200 [00:16<00:14,  6.42it/s]SST-2:  56%|█████▌    | 111/200 [00:16<00:13,  6.77it/s]SST-2:  56%|█████▌    | 112/200 [00:17<00:12,  7.04it/s]SST-2:  56%|█████▋    | 113/200 [00:17<00:12,  7.24it/s]SST-2:  57%|█████▋    | 114/200 [00:17<00:11,  7.38it/s]SST-2:  57%|█████▊    | 115/200 [00:17<00:11,  7.49it/s]SST-2:  58%|█████▊    | 116/200 [00:17<00:11,  7.57it/s]SST-2:  58%|█████▊    | 117/200 [00:17<00:10,  7.63it/s]SST-2:  59%|█████▉    | 118/200 [00:17<00:10,  7.66it/s]SST-2:  60%|█████▉    | 119/200 [00:18<00:10,  7.69it/s]SST-2:  60%|██████    | 120/200 [00:18<00:10,  7.71it/s]SST-2:  60%|██████    | 121/200 [00:18<00:10,  7.73it/s]SST-2:  61%|██████    | 122/200 [00:18<00:10,  7.73it/s]SST-2:  62%|██████▏   | 123/200 [00:18<00:10,  7.33it/s]SST-2:  62%|██████▏   | 124/200 [00:18<00:14,  5.12it/s]SST-2:  62%|██████▎   | 125/200 [00:19<00:16,  4.60it/s]SST-2:  63%|██████▎   | 126/200 [00:19<00:14,  5.17it/s]SST-2:  64%|██████▎   | 127/200 [00:19<00:12,  5.73it/s]SST-2:  64%|██████▍   | 128/200 [00:19<00:11,  6.21it/s]SST-2:  64%|██████▍   | 129/200 [00:19<00:10,  6.60it/s]SST-2:  65%|██████▌   | 130/200 [00:19<00:10,  6.90it/s]SST-2:  66%|██████▌   | 131/200 [00:19<00:09,  7.11it/s]SST-2:  66%|██████▌   | 132/200 [00:20<00:09,  7.29it/s]SST-2:  66%|██████▋   | 133/200 [00:20<00:09,  7.42it/s]SST-2:  67%|██████▋   | 134/200 [00:20<00:08,  7.51it/s]SST-2:  68%|██████▊   | 135/200 [00:20<00:08,  7.58it/s]SST-2:  68%|██████▊   | 136/200 [00:20<00:08,  7.64it/s]SST-2:  68%|██████▊   | 137/200 [00:20<00:08,  7.68it/s]SST-2:  69%|██████▉   | 138/200 [00:20<00:08,  7.69it/s]SST-2:  70%|██████▉   | 139/200 [00:20<00:07,  7.71it/s]SST-2:  70%|███████   | 140/200 [00:21<00:07,  7.72it/s]SST-2:  70%|███████   | 141/200 [00:21<00:07,  7.73it/s]SST-2:  71%|███████   | 142/200 [00:21<00:08,  6.49it/s]SST-2:  72%|███████▏  | 143/200 [00:21<00:10,  5.28it/s]SST-2:  72%|███████▏  | 144/200 [00:21<00:11,  4.69it/s]SST-2:  72%|███████▎  | 145/200 [00:22<00:10,  5.23it/s]SST-2:  73%|███████▎  | 146/200 [00:22<00:09,  5.80it/s]SST-2:  74%|███████▎  | 147/200 [00:22<00:08,  6.28it/s]SST-2:  74%|███████▍  | 148/200 [00:22<00:07,  6.66it/s]SST-2:  74%|███████▍  | 149/200 [00:22<00:07,  6.96it/s]SST-2:  75%|███████▌  | 150/200 [00:22<00:06,  7.18it/s]SST-2:  76%|███████▌  | 151/200 [00:22<00:06,  7.33it/s]SST-2:  76%|███████▌  | 152/200 [00:23<00:06,  7.45it/s]SST-2:  76%|███████▋  | 153/200 [00:23<00:06,  7.55it/s]SST-2:  77%|███████▋  | 154/200 [00:23<00:06,  7.61it/s]SST-2:  78%|███████▊  | 155/200 [00:23<00:05,  7.66it/s]SST-2:  78%|███████▊  | 156/200 [00:23<00:05,  7.69it/s]SST-2:  78%|███████▊  | 157/200 [00:23<00:05,  7.72it/s]SST-2:  79%|███████▉  | 158/200 [00:23<00:05,  7.74it/s]SST-2:  80%|███████▉  | 159/200 [00:23<00:05,  7.71it/s]SST-2:  80%|████████  | 160/200 [00:24<00:05,  7.67it/s]SST-2:  80%|████████  | 161/200 [00:24<00:06,  5.69it/s]SST-2:  81%|████████  | 162/200 [00:24<00:07,  4.90it/s]SST-2:  82%|████████▏ | 163/200 [00:24<00:07,  4.86it/s]SST-2:  82%|████████▏ | 164/200 [00:24<00:06,  5.47it/s]SST-2:  82%|████████▎ | 165/200 [00:25<00:05,  6.00it/s]SST-2:  83%|████████▎ | 166/200 [00:25<00:05,  6.44it/s]SST-2:  84%|████████▎ | 167/200 [00:25<00:04,  6.79it/s]SST-2:  84%|████████▍ | 168/200 [00:25<00:04,  7.05it/s]SST-2:  84%|████████▍ | 169/200 [00:25<00:04,  7.25it/s]SST-2:  85%|████████▌ | 170/200 [00:25<00:04,  7.39it/s]SST-2:  86%|████████▌ | 171/200 [00:25<00:03,  7.49it/s]SST-2:  86%|████████▌ | 172/200 [00:25<00:03,  7.58it/s]SST-2:  86%|████████▋ | 173/200 [00:26<00:03,  7.64it/s]SST-2:  87%|████████▋ | 174/200 [00:26<00:03,  7.69it/s]SST-2:  88%|████████▊ | 175/200 [00:26<00:03,  7.72it/s]SST-2:  88%|████████▊ | 176/200 [00:26<00:03,  7.74it/s]SST-2:  88%|████████▊ | 177/200 [00:26<00:02,  7.75it/s]SST-2:  89%|████████▉ | 178/200 [00:26<00:02,  7.75it/s]SST-2:  90%|████████▉ | 179/200 [00:26<00:02,  7.32it/s]SST-2:  90%|█████████ | 180/200 [00:27<00:03,  5.11it/s]SST-2:  90%|█████████ | 181/200 [00:27<00:03,  5.08it/s]SST-2:  91%|█████████ | 182/200 [00:27<00:03,  4.98it/s]SST-2:  92%|█████████▏| 183/200 [00:27<00:03,  5.58it/s]SST-2:  92%|█████████▏| 184/200 [00:27<00:02,  6.08it/s]SST-2:  92%|█████████▎| 185/200 [00:28<00:02,  6.50it/s]SST-2:  93%|█████████▎| 186/200 [00:28<00:02,  6.84it/s]SST-2:  94%|█████████▎| 187/200 [00:28<00:01,  7.10it/s]SST-2:  94%|█████████▍| 188/200 [00:28<00:01,  7.29it/s]SST-2:  94%|█████████▍| 189/200 [00:28<00:01,  7.43it/s]SST-2:  95%|█████████▌| 190/200 [00:28<00:01,  7.53it/s]SST-2:  96%|█████████▌| 191/200 [00:28<00:01,  7.59it/s]SST-2:  96%|█████████▌| 192/200 [00:28<00:01,  7.64it/s]SST-2:  96%|█████████▋| 193/200 [00:29<00:00,  7.68it/s]SST-2:  97%|█████████▋| 194/200 [00:29<00:00,  7.71it/s]SST-2:  98%|█████████▊| 195/200 [00:29<00:00,  7.73it/s]SST-2:  98%|█████████▊| 196/200 [00:29<00:00,  7.75it/s]SST-2:  98%|█████████▊| 197/200 [00:29<00:00,  7.76it/s]SST-2:  99%|█████████▉| 198/200 [00:29<00:00,  7.36it/s]SST-2: 100%|█████████▉| 199/200 [00:29<00:00,  5.74it/s]SST-2: 100%|██████████| 200/200 [00:30<00:00,  4.94it/s]SST-2: 100%|██████████| 200/200 [00:30<00:00,  6.61it/s]

SST-2 Text Baseline Accuracy: 92.0% (184/200)

Samples:
  Text: it 's a charming and often affecting journey . ... | GT: positive | Pred: positive
reason: the
  Text: unflinchingly bleak and desperate ... | GT: negative | Pred: negative
user: 
answ
  Text: allows us to hope that nolan is poised to embark a... | GT: positive | Pred: positive
reason: the
  Text: the acting , costumes , music , cinematography and... | GT: positive | Pred: positive
explanation
  Text: it 's slow -- very , very slow . ... | GT: negative | Pred: negative
the text ex

============================================================
SST-2 TEXT BASELINES SUMMARY
============================================================
Mistral Text: 88.5%
Llama Text:   92.0%
Bridge (8 tokens): 94.7%
Text-Relay:   71.0%
Random:       50.0%
============================================================

Results saved to: runs/sst2_baselines_20251213_164347/sst2_baselines.json

[Sat Dec 13 16:45:13 PST 2025] Starting AG News text baselines...
/users/sujinesh/.local/lib/python3.10/site-packages/transformers/utils/hub.py:128: FutureWarning: Using `TRANSFORMERS_CACHE` is deprecated and will be removed in v5 of Transformers. Use `HF_HOME` instead.
  warnings.warn(
Using GPU 0 (4 available): cuda:0
============================================================
AG NEWS TEXT BASELINES
============================================================
Evaluating direct text classification (no bridge)
============================================================

Loading Mistral...
Downloading shards:   0%|          | 0/3 [00:00<?, ?it/s]Downloading shards: 100%|██████████| 3/3 [00:00<00:00, 3403.55it/s]
Loading checkpoint shards:   0%|          | 0/3 [00:00<?, ?it/s]Loading checkpoint shards:  33%|███▎      | 1/3 [00:00<00:00,  9.62it/s]Loading checkpoint shards: 100%|██████████| 3/3 [00:00<00:00, 13.83it/s]Loading checkpoint shards: 100%|██████████| 3/3 [00:00<00:00, 13.24it/s]

============================================================
AG NEWS TEXT BASELINE
============================================================
AG News:   0%|          | 0/200 [00:00<?, ?it/s]AG News:   0%|          | 1/200 [00:00<01:15,  2.65it/s]AG News:   1%|          | 2/200 [00:00<01:02,  3.19it/s]AG News:   2%|▏         | 4/200 [00:00<00:34,  5.66it/s]AG News:   2%|▎         | 5/200 [00:00<00:32,  6.02it/s]AG News:   3%|▎         | 6/200 [00:01<00:34,  5.65it/s]AG News:   4%|▎         | 7/200 [00:01<00:45,  4.26it/s]AG News:   4%|▍         | 8/200 [00:01<00:46,  4.16it/s]AG News:   4%|▍         | 9/200 [00:01<00:41,  4.58it/s]AG News:   5%|▌         | 10/200 [00:02<00:37,  5.09it/s]AG News:   6%|▌         | 11/200 [00:02<00:35,  5.40it/s]AG News:   6%|▌         | 12/200 [00:02<00:32,  5.81it/s]AG News:   6%|▋         | 13/200 [00:02<00:31,  5.97it/s]AG News:   8%|▊         | 17/200 [00:02<00:15, 12.15it/s]AG News:  10%|▉         | 19/200 [00:02<00:15, 11.59it/s]AG News:  11%|█         | 22/200 [00:03<00:12, 14.40it/s]AG News:  12%|█▎        | 25/200 [00:03<00:12, 14.06it/s]AG News:  14%|█▎        | 27/200 [00:03<00:13, 12.96it/s]AG News:  14%|█▍        | 29/200 [00:03<00:13, 12.87it/s]AG News:  16%|█▌        | 31/200 [00:03<00:13, 12.46it/s]AG News:  16%|█▋        | 33/200 [00:03<00:12, 13.16it/s]AG News:  18%|█▊        | 35/200 [00:04<00:23,  7.01it/s]AG News:  18%|█▊        | 37/200 [00:04<00:25,  6.49it/s]AG News:  20%|█▉        | 39/200 [00:05<00:23,  6.85it/s]AG News:  20%|██        | 40/200 [00:05<00:22,  7.01it/s]AG News:  22%|██▏       | 44/200 [00:05<00:16,  9.69it/s]AG News:  24%|██▎       | 47/200 [00:05<00:13, 11.18it/s]AG News:  24%|██▍       | 49/200 [00:06<00:16,  9.41it/s]AG News:  26%|██▌       | 51/200 [00:06<00:15,  9.68it/s]AG News:  26%|██▋       | 53/200 [00:06<00:15,  9.50it/s]AG News:  28%|██▊       | 55/200 [00:06<00:14,  9.78it/s]AG News:  28%|██▊       | 57/200 [00:07<00:20,  7.13it/s]AG News:  29%|██▉       | 58/200 [00:07<00:22,  6.19it/s]AG News:  30%|██▉       | 59/200 [00:07<00:24,  5.67it/s]AG News:  30%|███       | 60/200 [00:07<00:24,  5.81it/s]AG News:  32%|███▏      | 64/200 [00:07<00:12, 10.53it/s]AG News:  33%|███▎      | 66/200 [00:08<00:14,  9.26it/s]AG News:  34%|███▍      | 68/200 [00:08<00:16,  8.19it/s]AG News:  35%|███▌      | 70/200 [00:08<00:16,  7.84it/s]AG News:  36%|███▌      | 71/200 [00:08<00:16,  7.86it/s]AG News:  37%|███▋      | 74/200 [00:09<00:13,  9.56it/s]AG News:  38%|███▊      | 76/200 [00:09<00:12,  9.84it/s]AG News:  39%|███▉      | 78/200 [00:09<00:12, 10.04it/s]AG News:  40%|████      | 80/200 [00:09<00:13,  9.00it/s]AG News:  40%|████      | 81/200 [00:10<00:18,  6.43it/s]AG News:  42%|████▏     | 83/200 [00:10<00:17,  6.73it/s]AG News:  42%|████▏     | 84/200 [00:10<00:17,  6.66it/s]AG News:  42%|████▎     | 85/200 [00:10<00:16,  7.07it/s]AG News:  43%|████▎     | 86/200 [00:10<00:16,  6.90it/s]AG News:  44%|████▎     | 87/200 [00:10<00:16,  6.76it/s]AG News:  44%|████▍     | 88/200 [00:11<00:16,  6.67it/s]AG News:  46%|████▌     | 91/200 [00:11<00:11,  9.59it/s]AG News:  48%|████▊     | 95/200 [00:11<00:07, 14.65it/s]AG News:  50%|████▉     | 99/200 [00:11<00:06, 16.25it/s]AG News:  50%|█████     | 101/200 [00:11<00:06, 14.46it/s]AG News:  52%|█████▏    | 103/200 [00:11<00:06, 14.35it/s]AG News:  52%|█████▎    | 105/200 [00:12<00:08, 10.84it/s]AG News:  54%|█████▎    | 107/200 [00:12<00:09,  9.50it/s]AG News:  55%|█████▍    | 109/200 [00:12<00:12,  7.57it/s]AG News:  55%|█████▌    | 110/200 [00:13<00:13,  6.67it/s]AG News:  56%|█████▌    | 112/200 [00:13<00:11,  7.57it/s]AG News:  56%|█████▋    | 113/200 [00:13<00:11,  7.33it/s]AG News:  58%|█████▊    | 117/200 [00:13<00:08, 10.33it/s]AG News:  60%|█████▉    | 119/200 [00:14<00:07, 10.33it/s]AG News:  62%|██████▏   | 123/200 [00:14<00:06, 12.12it/s]AG News:  62%|██████▎   | 125/200 [00:14<00:07,  9.99it/s]AG News:  64%|██████▎   | 127/200 [00:14<00:08,  9.04it/s]AG News:  65%|██████▌   | 130/200 [00:15<00:06, 10.23it/s]AG News:  66%|██████▌   | 132/200 [00:15<00:09,  7.10it/s]AG News:  67%|██████▋   | 134/200 [00:15<00:09,  6.78it/s]AG News:  68%|██████▊   | 137/200 [00:16<00:07,  8.16it/s]AG News:  70%|███████   | 140/200 [00:16<00:06,  9.43it/s]AG News:  71%|███████   | 142/200 [00:16<00:05,  9.68it/s]AG News:  72%|███████▏  | 144/200 [00:16<00:05,  9.90it/s]AG News:  73%|███████▎  | 146/200 [00:17<00:06,  8.62it/s]AG News:  74%|███████▎  | 147/200 [00:17<00:06,  8.69it/s]AG News:  74%|███████▍  | 148/200 [00:17<00:06,  8.15it/s]AG News:  76%|███████▌  | 152/200 [00:17<00:04, 10.87it/s]AG News:  77%|███████▋  | 154/200 [00:17<00:03, 11.58it/s]AG News:  78%|███████▊  | 156/200 [00:17<00:03, 11.27it/s]AG News:  79%|███████▉  | 158/200 [00:18<00:04, 10.00it/s]AG News:  80%|████████  | 160/200 [00:18<00:06,  6.16it/s]AG News:  81%|████████  | 162/200 [00:19<00:05,  7.02it/s]AG News:  82%|████████▏ | 163/200 [00:19<00:05,  6.90it/s]AG News:  82%|████████▏ | 164/200 [00:19<00:04,  7.25it/s]AG News:  82%|████████▎ | 165/200 [00:19<00:04,  7.03it/s]AG News:  84%|████████▍ | 169/200 [00:19<00:02, 12.32it/s]AG News:  86%|████████▌ | 171/200 [00:19<00:02, 10.38it/s]AG News:  86%|████████▋ | 173/200 [00:20<00:03,  8.79it/s]AG News:  88%|████████▊ | 175/200 [00:20<00:03,  8.22it/s]AG News:  88%|████████▊ | 176/200 [00:20<00:02,  8.35it/s]AG News:  88%|████████▊ | 177/200 [00:20<00:02,  7.87it/s]AG News:  90%|█████████ | 181/200 [00:20<00:01, 12.98it/s]AG News:  92%|█████████▏| 183/200 [00:20<00:01, 14.29it/s]AG News:  92%|█████████▎| 185/200 [00:21<00:01,  8.79it/s]AG News:  94%|█████████▎| 187/200 [00:21<00:01,  8.82it/s]AG News:  94%|█████████▍| 189/200 [00:21<00:01,  7.93it/s]AG News:  96%|█████████▌| 191/200 [00:22<00:01,  8.56it/s]AG News:  96%|█████████▋| 193/200 [00:22<00:00,  8.38it/s]AG News:  97%|█████████▋| 194/200 [00:22<00:00,  7.96it/s]AG News:  98%|█████████▊| 196/200 [00:22<00:00,  8.67it/s]AG News: 100%|██████████| 200/200 [00:22<00:00, 13.31it/s]AG News: 100%|██████████| 200/200 [00:22<00:00,  8.75it/s]

AG News Text Baseline Accuracy: 79.0% (158/200)

Samples:
  Text: Fears for T N pension after talks Unions represent... | GT: business | Pred: business
  Text: The Race is On: Second Private Team Sets Launch Da... | GT: science | Pred: science (specificall
  Text: Ky. Company Wins Grant to Study Peptides (AP) AP -... | GT: science | Pred: science
  Text: Prediction Unit Helps Forecast Wildfires (AP) AP -... | GT: science | Pred: science (specificall
  Text: Calif. Aims to Limit Farm-Related Smog (AP) AP - S... | GT: science | Pred: science (specificall

Loading Llama...
Downloading shards:   0%|          | 0/4 [00:00<?, ?it/s]Downloading shards: 100%|██████████| 4/4 [00:00<00:00, 4138.44it/s]
Loading checkpoint shards:   0%|          | 0/4 [00:00<?, ?it/s]Loading checkpoint shards:  25%|██▌       | 1/4 [00:00<00:00,  6.83it/s]Loading checkpoint shards:  50%|█████     | 2/4 [00:00<00:00,  7.37it/s]Loading checkpoint shards:  75%|███████▌  | 3/4 [00:00<00:00,  7.26it/s]Loading checkpoint shards: 100%|██████████| 4/4 [00:00<00:00,  6.18it/s]Loading checkpoint shards: 100%|██████████| 4/4 [00:00<00:00,  6.51it/s]

============================================================
AG NEWS TEXT BASELINE
============================================================
AG News:   0%|          | 0/200 [00:00<?, ?it/s]/users/sujinesh/.local/lib/python3.10/site-packages/transformers/generation/configuration_utils.py:590: UserWarning: `do_sample` is set to `False`. However, `temperature` is set to `0.6` -- this flag is only used in sample-based generation modes. You should set `do_sample=True` or unset `temperature`.
  warnings.warn(
/users/sujinesh/.local/lib/python3.10/site-packages/transformers/generation/configuration_utils.py:595: UserWarning: `do_sample` is set to `False`. However, `top_p` is set to `0.9` -- this flag is only used in sample-based generation modes. You should set `do_sample=True` or unset `top_p`.
  warnings.warn(
AG News:   0%|          | 1/200 [00:00<00:26,  7.49it/s]AG News:   1%|          | 2/200 [00:00<00:26,  7.57it/s]AG News:   2%|▏         | 3/200 [00:00<00:25,  7.64it/s]AG News:   2%|▏         | 4/200 [00:00<00:25,  7.66it/s]AG News:   2%|▎         | 5/200 [00:00<00:25,  7.66it/s]AG News:   3%|▎         | 6/200 [00:00<00:32,  5.96it/s]AG News:   4%|▎         | 7/200 [00:01<00:35,  5.49it/s]AG News:   4%|▍         | 8/200 [00:01<00:31,  6.02it/s]AG News:   4%|▍         | 9/200 [00:01<00:29,  6.46it/s]AG News:   5%|▌         | 10/200 [00:01<00:27,  6.81it/s]AG News:   6%|▌         | 11/200 [00:01<00:26,  7.07it/s]AG News:   6%|▌         | 12/200 [00:01<00:25,  7.26it/s]AG News:   6%|▋         | 13/200 [00:01<00:28,  6.54it/s]AG News:   7%|▋         | 14/200 [00:02<00:36,  5.05it/s]AG News:   8%|▊         | 15/200 [00:02<00:40,  4.56it/s]AG News:   8%|▊         | 16/200 [00:02<00:36,  5.11it/s]AG News:   8%|▊         | 17/200 [00:02<00:32,  5.68it/s]AG News:   9%|▉         | 18/200 [00:02<00:29,  6.16it/s]AG News:  10%|▉         | 19/200 [00:03<00:27,  6.56it/s]AG News:  10%|█         | 20/200 [00:03<00:26,  6.88it/s]AG News:  10%|█         | 21/200 [00:03<00:25,  7.11it/s]AG News:  11%|█         | 22/200 [00:03<00:24,  7.29it/s]AG News:  12%|█▏        | 23/200 [00:03<00:23,  7.42it/s]AG News:  12%|█▏        | 24/200 [00:03<00:23,  7.38it/s]AG News:  12%|█▎        | 25/200 [00:03<00:25,  6.96it/s]AG News:  13%|█▎        | 26/200 [00:04<00:26,  6.69it/s]AG News:  14%|█▎        | 27/200 [00:04<00:26,  6.54it/s]AG News:  14%|█▍        | 28/200 [00:04<00:26,  6.50it/s]AG News:  14%|█▍        | 29/200 [00:04<00:25,  6.68it/s]AG News:  15%|█▌        | 30/200 [00:04<00:24,  6.91it/s]AG News:  16%|█▌        | 31/200 [00:04<00:28,  6.01it/s]AG News:  16%|█▌        | 32/200 [00:05<00:36,  4.58it/s]AG News:  16%|█▋        | 33/200 [00:05<00:35,  4.69it/s]AG News:  17%|█▋        | 34/200 [00:05<00:31,  5.21it/s]AG News:  18%|█▊        | 35/200 [00:05<00:28,  5.77it/s]AG News:  18%|█▊        | 36/200 [00:05<00:26,  6.24it/s]AG News:  18%|█▊        | 37/200 [00:05<00:24,  6.62it/s]AG News:  19%|█▉        | 38/200 [00:06<00:23,  6.92it/s]AG News:  20%|█▉        | 39/200 [00:06<00:22,  7.14it/s]AG News:  20%|██        | 40/200 [00:06<00:21,  7.30it/s]AG News:  20%|██        | 41/200 [00:06<00:21,  7.42it/s]AG News:  21%|██        | 42/200 [00:06<00:21,  7.51it/s]AG News:  22%|██▏       | 43/200 [00:06<00:20,  7.57it/s]AG News:  22%|██▏       | 44/200 [00:06<00:20,  7.61it/s]AG News:  22%|██▎       | 45/200 [00:06<00:20,  7.64it/s]AG News:  23%|██▎       | 46/200 [00:07<00:20,  7.67it/s]AG News:  24%|██▎       | 47/200 [00:07<00:19,  7.69it/s]AG News:  24%|██▍       | 48/200 [00:07<00:19,  7.70it/s]AG News:  24%|██▍       | 49/200 [00:07<00:19,  7.56it/s]AG News:  25%|██▌       | 50/200 [00:07<00:26,  5.70it/s]AG News:  26%|██▌       | 51/200 [00:08<00:30,  4.90it/s]AG News:  26%|██▌       | 52/200 [00:08<00:30,  4.86it/s]AG News:  26%|██▋       | 53/200 [00:08<00:26,  5.47it/s]AG News:  27%|██▋       | 54/200 [00:08<00:24,  6.00it/s]AG News:  28%|██▊       | 55/200 [00:08<00:22,  6.43it/s]AG News:  28%|██▊       | 56/200 [00:08<00:21,  6.78it/s]AG News:  28%|██▊       | 57/200 [00:08<00:20,  7.04it/s]AG News:  29%|██▉       | 58/200 [00:08<00:19,  7.23it/s]AG News:  30%|██▉       | 59/200 [00:09<00:19,  7.38it/s]AG News:  30%|███       | 60/200 [00:09<00:18,  7.46it/s]AG News:  30%|███       | 61/200 [00:09<00:18,  7.53it/s]AG News:  31%|███       | 62/200 [00:09<00:18,  7.59it/s]AG News:  32%|███▏      | 63/200 [00:09<00:18,  7.61it/s]AG News:  32%|███▏      | 64/200 [00:09<00:17,  7.64it/s]AG News:  32%|███▎      | 65/200 [00:09<00:17,  7.66it/s]AG News:  33%|███▎      | 66/200 [00:10<00:17,  7.68it/s]AG News:  34%|███▎      | 67/200 [00:10<00:17,  7.65it/s]AG News:  34%|███▍      | 68/200 [00:10<00:19,  6.64it/s]AG News:  34%|███▍      | 69/200 [00:10<00:25,  5.18it/s]AG News:  35%|███▌      | 70/200 [00:10<00:28,  4.60it/s]AG News:  36%|███▌      | 71/200 [00:11<00:25,  5.14it/s]AG News:  36%|███▌      | 72/200 [00:11<00:22,  5.71it/s]AG News:  36%|███▋      | 73/200 [00:11<00:20,  6.20it/s]AG News:  37%|███▋      | 74/200 [00:11<00:19,  6.60it/s]AG News:  38%|███▊      | 75/200 [00:11<00:18,  6.89it/s]AG News:  38%|███▊      | 76/200 [00:11<00:17,  7.12it/s]AG News:  38%|███▊      | 77/200 [00:11<00:16,  7.29it/s]AG News:  39%|███▉      | 78/200 [00:11<00:16,  7.43it/s]AG News:  40%|███▉      | 79/200 [00:12<00:16,  7.50it/s]AG News:  40%|████      | 80/200 [00:12<00:15,  7.57it/s]AG News:  40%|████      | 81/200 [00:12<00:15,  7.61it/s]AG News:  41%|████      | 82/200 [00:12<00:15,  7.66it/s]AG News:  42%|████▏     | 83/200 [00:12<00:15,  7.68it/s]AG News:  42%|████▏     | 84/200 [00:12<00:15,  7.70it/s]AG News:  42%|████▎     | 85/200 [00:12<00:14,  7.71it/s]AG News:  43%|████▎     | 86/200 [00:13<00:14,  7.70it/s]AG News:  44%|████▎     | 87/200 [00:13<00:20,  5.62it/s]AG News:  44%|████▍     | 88/200 [00:13<00:23,  4.86it/s]AG News:  44%|████▍     | 89/200 [00:13<00:22,  4.88it/s]AG News:  45%|████▌     | 90/200 [00:13<00:20,  5.38it/s]AG News:  46%|████▌     | 91/200 [00:14<00:18,  5.92it/s]AG News:  46%|████▌     | 92/200 [00:14<00:16,  6.36it/s]AG News:  46%|████▋     | 93/200 [00:14<00:15,  6.71it/s]AG News:  47%|████▋     | 94/200 [00:14<00:15,  6.98it/s]AG News:  48%|████▊     | 95/200 [00:14<00:14,  7.19it/s]AG News:  48%|████▊     | 96/200 [00:14<00:14,  7.34it/s]AG News:  48%|████▊     | 97/200 [00:14<00:13,  7.45it/s]AG News:  49%|████▉     | 98/200 [00:14<00:13,  7.49it/s]AG News:  50%|████▉     | 99/200 [00:15<00:13,  7.55it/s]AG News:  50%|█████     | 100/200 [00:15<00:13,  7.59it/s]AG News:  50%|█████     | 101/200 [00:15<00:13,  7.60it/s]AG News:  51%|█████     | 102/200 [00:15<00:12,  7.63it/s]AG News:  52%|█████▏    | 103/200 [00:15<00:12,  7.65it/s]AG News:  52%|█████▏    | 104/200 [00:15<00:12,  7.69it/s]AG News:  52%|█████▎    | 105/200 [00:15<00:12,  7.62it/s]AG News:  53%|█████▎    | 106/200 [00:16<00:16,  5.68it/s]AG News:  54%|█████▎    | 107/200 [00:16<00:19,  4.89it/s]AG News:  54%|█████▍    | 108/200 [00:16<00:18,  4.86it/s]AG News:  55%|█████▍    | 109/200 [00:16<00:16,  5.46it/s]AG News:  55%|█████▌    | 110/200 [00:16<00:15,  6.00it/s]AG News:  56%|█████▌    | 111/200 [00:17<00:13,  6.42it/s]AG News:  56%|█████▌    | 112/200 [00:17<00:13,  6.76it/s]AG News:  56%|█████▋    | 113/200 [00:17<00:12,  7.03it/s]AG News:  57%|█████▋    | 114/200 [00:17<00:11,  7.23it/s]AG News:  57%|█████▊    | 115/200 [00:17<00:11,  7.37it/s]AG News:  58%|█████▊    | 116/200 [00:17<00:11,  7.50it/s]AG News:  58%|█████▊    | 117/200 [00:17<00:10,  7.57it/s]AG News:  59%|█████▉    | 118/200 [00:17<00:10,  7.56it/s]AG News:  60%|█████▉    | 119/200 [00:18<00:10,  7.61it/s]AG News:  60%|██████    | 120/200 [00:18<00:10,  7.64it/s]AG News:  60%|██████    | 121/200 [00:18<00:10,  7.65it/s]AG News:  61%|██████    | 122/200 [00:18<00:10,  7.68it/s]AG News:  62%|██████▏   | 123/200 [00:18<00:10,  7.69it/s]AG News:  62%|██████▏   | 124/200 [00:18<00:10,  7.32it/s]AG News:  62%|██████▎   | 125/200 [00:18<00:13,  5.71it/s]AG News:  63%|██████▎   | 126/200 [00:19<00:15,  4.90it/s]AG News:  64%|██████▎   | 127/200 [00:19<00:15,  4.84it/s]AG News:  64%|██████▍   | 128/200 [00:19<00:13,  5.45it/s]AG News:  64%|██████▍   | 129/200 [00:19<00:11,  5.97it/s]AG News:  65%|██████▌   | 130/200 [00:19<00:10,  6.40it/s]AG News:  66%|██████▌   | 131/200 [00:19<00:10,  6.73it/s]AG News:  66%|██████▌   | 132/200 [00:20<00:09,  7.00it/s]AG News:  66%|██████▋   | 133/200 [00:20<00:09,  7.19it/s]AG News:  67%|██████▋   | 134/200 [00:20<00:08,  7.35it/s]AG News:  68%|██████▊   | 135/200 [00:20<00:08,  7.45it/s]AG News:  68%|██████▊   | 136/200 [00:20<00:08,  7.52it/s]AG News:  68%|██████▊   | 137/200 [00:20<00:08,  7.60it/s]AG News:  69%|██████▉   | 138/200 [00:20<00:08,  7.63it/s]AG News:  70%|██████▉   | 139/200 [00:21<00:07,  7.65it/s]AG News:  70%|███████   | 140/200 [00:21<00:07,  7.69it/s]AG News:  70%|███████   | 141/200 [00:21<00:07,  7.70it/s]AG News:  71%|███████   | 142/200 [00:21<00:07,  7.72it/s]AG News:  72%|███████▏  | 143/200 [00:21<00:08,  7.10it/s]AG News:  72%|███████▏  | 144/200 [00:21<00:10,  5.15it/s]AG News:  72%|███████▎  | 145/200 [00:22<00:11,  4.61it/s]AG News:  73%|███████▎  | 146/200 [00:22<00:10,  5.16it/s]AG News:  74%|███████▎  | 147/200 [00:22<00:09,  5.72it/s]AG News:  74%|███████▍  | 148/200 [00:22<00:08,  6.20it/s]AG News:  74%|███████▍  | 149/200 [00:22<00:07,  6.59it/s]AG News:  75%|███████▌  | 150/200 [00:22<00:07,  6.88it/s]AG News:  76%|███████▌  | 151/200 [00:22<00:06,  7.12it/s]AG News:  76%|███████▌  | 152/200 [00:23<00:06,  7.29it/s]AG News:  76%|███████▋  | 153/200 [00:23<00:06,  7.42it/s]AG News:  77%|███████▋  | 154/200 [00:23<00:06,  7.51it/s]AG News:  78%|███████▊  | 155/200 [00:23<00:05,  7.57it/s]AG News:  78%|███████▊  | 156/200 [00:23<00:05,  7.62it/s]AG News:  78%|███████▊  | 157/200 [00:23<00:05,  7.65it/s]AG News:  79%|███████▉  | 158/200 [00:23<00:05,  7.67it/s]AG News:  80%|███████▉  | 159/200 [00:24<00:05,  7.68it/s]AG News:  80%|████████  | 160/200 [00:24<00:05,  7.69it/s]AG News:  80%|████████  | 161/200 [00:24<00:05,  7.69it/s]AG News:  81%|████████  | 162/200 [00:24<00:05,  6.43it/s]AG News:  82%|████████▏ | 163/200 [00:24<00:07,  5.25it/s]AG News:  82%|████████▏ | 164/200 [00:25<00:07,  4.67it/s]AG News:  82%|████████▎ | 165/200 [00:25<00:06,  5.22it/s]AG News:  83%|████████▎ | 166/200 [00:25<00:05,  5.77it/s]AG News:  84%|████████▎ | 167/200 [00:25<00:05,  6.24it/s]AG News:  84%|████████▍ | 168/200 [00:25<00:04,  6.62it/s]AG News:  84%|████████▍ | 169/200 [00:25<00:04,  6.92it/s]AG News:  85%|████████▌ | 170/200 [00:25<00:04,  7.14it/s]AG News:  86%|████████▌ | 171/200 [00:25<00:03,  7.27it/s]AG News:  86%|████████▌ | 172/200 [00:26<00:03,  7.41it/s]AG News:  86%|████████▋ | 173/200 [00:26<00:03,  7.50it/s]AG News:  87%|████████▋ | 174/200 [00:26<00:03,  7.56it/s]AG News:  88%|████████▊ | 175/200 [00:26<00:03,  7.59it/s]AG News:  88%|████████▊ | 176/200 [00:26<00:03,  7.40it/s]AG News:  88%|████████▊ | 177/200 [00:26<00:03,  7.10it/s]AG News:  89%|████████▉ | 178/200 [00:26<00:03,  7.01it/s]AG News:  90%|████████▉ | 179/200 [00:27<00:03,  6.94it/s]AG News:  90%|█████████ | 180/200 [00:27<00:03,  5.33it/s]AG News:  90%|█████████ | 181/200 [00:27<00:03,  5.22it/s]AG News:  91%|█████████ | 182/200 [00:27<00:03,  4.66it/s]AG News:  92%|█████████▏| 183/200 [00:27<00:03,  5.20it/s]AG News:  92%|█████████▏| 184/200 [00:28<00:02,  5.77it/s]AG News:  92%|█████████▎| 185/200 [00:28<00:02,  6.24it/s]AG News:  93%|█████████▎| 186/200 [00:28<00:02,  6.62it/s]AG News:  94%|█████████▎| 187/200 [00:28<00:01,  6.89it/s]AG News:  94%|█████████▍| 188/200 [00:28<00:01,  7.11it/s]AG News:  94%|█████████▍| 189/200 [00:28<00:01,  7.29it/s]AG News:  95%|█████████▌| 190/200 [00:28<00:01,  7.42it/s]AG News:  96%|█████████▌| 191/200 [00:28<00:01,  7.51it/s]AG News:  96%|█████████▌| 192/200 [00:29<00:01,  7.57it/s]AG News:  96%|█████████▋| 193/200 [00:29<00:00,  7.62it/s]AG News:  97%|█████████▋| 194/200 [00:29<00:00,  7.65it/s]AG News:  98%|█████████▊| 195/200 [00:29<00:00,  7.66it/s]AG News:  98%|█████████▊| 196/200 [00:29<00:00,  7.70it/s]AG News:  98%|█████████▊| 197/200 [00:29<00:00,  7.70it/s]AG News:  99%|█████████▉| 198/200 [00:29<00:00,  7.55it/s]AG News: 100%|█████████▉| 199/200 [00:30<00:00,  5.65it/s]AG News: 100%|██████████| 200/200 [00:30<00:00,  4.88it/s]AG News: 100%|██████████| 200/200 [00:30<00:00,  6.57it/s]

AG News Text Baseline Accuracy: 79.0% (158/200)

Samples:
  Text: Fears for T N pension after talks Unions represent... | GT: business | Pred: business. the articl
  Text: The Race is On: Second Private Team Sets Launch Da... | GT: science | Pred: science.  the articl
  Text: Ky. Company Wins Grant to Study Peptides (AP) AP -... | GT: science | Pred: science. the article
  Text: Prediction Unit Helps Forecast Wildfires (AP) AP -... | GT: science | Pred: science

explanation
  Text: Calif. Aims to Limit Farm-Related Smog (AP) AP - S... | GT: science | Pred: science → world (or 

============================================================
AG NEWS TEXT BASELINES SUMMARY
============================================================
Mistral Text: 79.0%
Llama Text:   79.0%
Bridge (8 tokens): 88.9%
Text-Relay:   64.5%
Random:       25.0%
============================================================

Results saved to: runs/agnews_baselines_20251213_164347/agnews_baselines.json

==============================================
COMPLETE!
==============================================

Results saved to:
  - runs/sst2_baselines_20251213_164347/sst2_baselines.json
  - runs/agnews_baselines_20251213_164347/agnews_baselines.json

SUMMARY:
--------
SST-2 Llama: 92.0% (Bridge: 94.7%, Text-Relay: 71.0%)
SST-2 Mistral: 88.5%
AG News Llama: 79.0% (Bridge: 88.9%, Text-Relay: 64.5%)
AG News Mistral: 79.0%

[Sat Dec 13 16:46:27 PST 2025] Done!
