=== PART 1: TREC TEXT BASELINES ===
/users/sujinesh/.local/lib/python3.10/site-packages/transformers/utils/hub.py:128: FutureWarning: Using `TRANSFORMERS_CACHE` is deprecated and will be removed in v5 of Transformers. Use `HF_HOME` instead.
  warnings.warn(
Using GPU 0 (4 available): cuda:0
============================================================
TREC TEXT BASELINES (6-class)
============================================================
Evaluating direct text classification (no bridge)
============================================================

Loading Mistral...
Downloading shards:   0%|          | 0/3 [00:00<?, ?it/s]Downloading shards: 100%|██████████| 3/3 [00:00<00:00, 3938.31it/s]
Loading checkpoint shards:   0%|          | 0/3 [00:00<?, ?it/s]Loading checkpoint shards:  33%|███▎      | 1/3 [00:00<00:00,  9.76it/s]Loading checkpoint shards: 100%|██████████| 3/3 [00:00<00:00, 14.06it/s]Loading checkpoint shards: 100%|██████████| 3/3 [00:00<00:00, 13.45it/s]

============================================================
TREC TEXT BASELINE (6-class)
============================================================
Classes: 6 - ['ABBR', 'ENTY', 'DESC', 'HUM', 'LOC', 'NUM']
Test samples: 500
TREC:   0%|          | 0/200 [00:00<?, ?it/s]TREC:   0%|          | 1/200 [00:00<02:41,  1.23it/s]TREC:   1%|          | 2/200 [00:00<01:18,  2.52it/s]TREC:   2%|▏         | 3/200 [00:01<00:57,  3.44it/s]TREC:   2%|▏         | 4/200 [00:01<00:46,  4.21it/s]TREC:   2%|▎         | 5/200 [00:01<00:40,  4.79it/s]TREC:   3%|▎         | 6/200 [00:01<00:36,  5.25it/s]TREC:   4%|▎         | 7/200 [00:01<00:34,  5.59it/s]TREC:   4%|▍         | 8/200 [00:01<00:32,  5.83it/s]TREC:   4%|▍         | 9/200 [00:02<00:31,  6.02it/s]TREC:   5%|▌         | 10/200 [00:02<00:31,  6.11it/s]TREC:   6%|▌         | 12/200 [00:02<00:25,  7.43it/s]TREC:   6%|▋         | 13/200 [00:02<00:26,  7.15it/s]TREC:   7%|▋         | 14/200 [00:02<00:26,  6.95it/s]TREC:   8%|▊         | 15/200 [00:02<00:27,  6.80it/s]TREC:   8%|▊         | 16/200 [00:03<00:31,  5.87it/s]TREC:   8%|▊         | 17/200 [00:03<00:39,  4.67it/s]TREC:   9%|▉         | 18/200 [00:03<00:43,  4.18it/s]TREC:  10%|▉         | 19/200 [00:03<00:39,  4.62it/s]TREC:  10%|█         | 20/200 [00:04<00:35,  5.04it/s]TREC:  10%|█         | 21/200 [00:04<00:33,  5.39it/s]TREC:  11%|█         | 22/200 [00:04<00:31,  5.65it/s]TREC:  12%|█▏        | 23/200 [00:04<00:30,  5.87it/s]TREC:  12%|█▏        | 24/200 [00:04<00:29,  6.04it/s]TREC:  12%|█▎        | 25/200 [00:04<00:28,  6.15it/s]TREC:  13%|█▎        | 26/200 [00:04<00:27,  6.23it/s]TREC:  14%|█▎        | 27/200 [00:05<00:27,  6.27it/s]TREC:  14%|█▍        | 29/200 [00:05<00:22,  7.74it/s]TREC:  16%|█▌        | 31/200 [00:05<00:19,  8.69it/s]TREC:  16%|█▋        | 33/200 [00:05<00:19,  8.44it/s]TREC:  17%|█▋        | 34/200 [00:06<00:26,  6.33it/s]TREC:  18%|█▊        | 35/200 [00:06<00:33,  4.88it/s]TREC:  18%|█▊        | 36/200 [00:06<00:32,  5.12it/s]TREC:  19%|█▉        | 38/200 [00:06<00:24,  6.50it/s]TREC:  20%|██        | 41/200 [00:07<00:19,  8.27it/s]TREC:  21%|██        | 42/200 [00:07<00:20,  7.87it/s]TREC:  22%|██▏       | 43/200 [00:07<00:20,  7.53it/s]TREC:  22%|██▏       | 44/200 [00:07<00:21,  7.25it/s]TREC:  22%|██▎       | 45/200 [00:07<00:22,  7.04it/s]TREC:  23%|██▎       | 46/200 [00:07<00:22,  6.85it/s]TREC:  24%|██▎       | 47/200 [00:07<00:22,  6.73it/s]TREC:  24%|██▍       | 48/200 [00:08<00:22,  6.65it/s]TREC:  25%|██▌       | 50/200 [00:08<00:20,  7.20it/s]TREC:  26%|██▌       | 51/200 [00:08<00:21,  7.00it/s]TREC:  26%|██▌       | 52/200 [00:08<00:27,  5.37it/s]TREC:  26%|██▋       | 53/200 [00:09<00:31,  4.64it/s]TREC:  27%|██▋       | 54/200 [00:09<00:39,  3.66it/s]TREC:  28%|██▊       | 55/200 [00:09<00:34,  4.17it/s]TREC:  28%|██▊       | 56/200 [00:09<00:31,  4.64it/s]TREC:  28%|██▊       | 57/200 [00:09<00:28,  5.06it/s]TREC:  29%|██▉       | 58/200 [00:10<00:26,  5.40it/s]TREC:  30%|███       | 60/200 [00:10<00:22,  6.35it/s]TREC:  30%|███       | 61/200 [00:10<00:21,  6.38it/s]TREC:  31%|███       | 62/200 [00:10<00:21,  6.41it/s]TREC:  32%|███▏      | 63/200 [00:10<00:21,  6.40it/s]TREC:  32%|███▏      | 64/200 [00:11<00:21,  6.42it/s]TREC:  33%|███▎      | 66/200 [00:11<00:17,  7.60it/s]TREC:  34%|███▎      | 67/200 [00:11<00:18,  7.29it/s]TREC:  34%|███▍      | 68/200 [00:11<00:19,  6.82it/s]TREC:  34%|███▍      | 69/200 [00:11<00:26,  4.91it/s]TREC:  35%|███▌      | 70/200 [00:12<00:29,  4.36it/s]TREC:  36%|███▌      | 72/200 [00:12<00:22,  5.71it/s]TREC:  36%|███▋      | 73/200 [00:12<00:21,  5.87it/s]TREC:  37%|███▋      | 74/200 [00:12<00:20,  6.01it/s]TREC:  38%|███▊      | 76/200 [00:12<00:18,  6.73it/s]TREC:  38%|███▊      | 77/200 [00:13<00:18,  6.66it/s]TREC:  39%|███▉      | 78/200 [00:13<00:18,  6.61it/s]TREC:  40%|███▉      | 79/200 [00:13<00:18,  6.56it/s]TREC:  40%|████      | 80/200 [00:13<00:18,  6.52it/s]TREC:  40%|████      | 81/200 [00:13<00:18,  6.51it/s]TREC:  41%|████      | 82/200 [00:13<00:18,  6.49it/s]TREC:  42%|████▏     | 83/200 [00:14<00:18,  6.48it/s]TREC:  42%|████▎     | 85/200 [00:14<00:14,  7.67it/s]TREC:  43%|████▎     | 86/200 [00:14<00:17,  6.34it/s]TREC:  44%|████▎     | 87/200 [00:14<00:24,  4.69it/s]TREC:  44%|████▍     | 88/200 [00:15<00:24,  4.56it/s]TREC:  44%|████▍     | 89/200 [00:15<00:22,  4.94it/s]TREC:  45%|████▌     | 90/200 [00:15<00:20,  5.29it/s]TREC:  46%|████▌     | 91/200 [00:15<00:19,  5.57it/s]TREC:  46%|████▌     | 92/200 [00:15<00:18,  5.81it/s]TREC:  46%|████▋     | 93/200 [00:15<00:17,  5.98it/s]TREC:  47%|████▋     | 94/200 [00:16<00:17,  6.12it/s]TREC:  48%|████▊     | 95/200 [00:16<00:16,  6.21it/s]TREC:  48%|████▊     | 97/200 [00:16<00:14,  6.92it/s]TREC:  49%|████▉     | 98/200 [00:16<00:15,  6.79it/s]TREC:  50%|████▉     | 99/200 [00:16<00:15,  6.69it/s]TREC:  50%|█████     | 100/200 [00:16<00:15,  6.63it/s]TREC:  50%|█████     | 101/200 [00:17<00:15,  6.58it/s]TREC:  51%|█████     | 102/200 [00:17<00:16,  5.95it/s]TREC:  52%|█████▏    | 103/200 [00:17<00:20,  4.68it/s]TREC:  52%|█████▏    | 104/200 [00:17<00:22,  4.20it/s]TREC:  52%|█████▎    | 105/200 [00:18<00:18,  5.03it/s]TREC:  53%|█████▎    | 106/200 [00:18<00:17,  5.37it/s]TREC:  54%|█████▎    | 107/200 [00:18<00:16,  5.65it/s]TREC:  54%|█████▍    | 108/200 [00:18<00:15,  5.86it/s]TREC:  55%|█████▍    | 109/200 [00:18<00:15,  6.02it/s]TREC:  55%|█████▌    | 110/200 [00:18<00:14,  6.14it/s]TREC:  56%|█████▌    | 111/200 [00:18<00:14,  6.23it/s]TREC:  56%|█████▌    | 112/200 [00:19<00:13,  6.29it/s]TREC:  57%|█████▋    | 114/200 [00:19<00:12,  7.00it/s]TREC:  57%|█████▊    | 115/200 [00:19<00:12,  6.86it/s]TREC:  58%|█████▊    | 116/200 [00:19<00:12,  6.75it/s]TREC:  58%|█████▊    | 117/200 [00:19<00:12,  6.66it/s]TREC:  59%|█████▉    | 118/200 [00:19<00:12,  6.56it/s]TREC:  60%|█████▉    | 119/200 [00:20<00:16,  5.04it/s]TREC:  60%|██████    | 120/200 [00:20<00:16,  4.78it/s]TREC:  60%|██████    | 121/200 [00:20<00:17,  4.61it/s]TREC:  62%|██████▏   | 123/200 [00:20<00:12,  6.09it/s]TREC:  62%|██████▏   | 124/200 [00:21<00:12,  6.18it/s]TREC:  63%|██████▎   | 126/200 [00:21<00:10,  7.31it/s]TREC:  64%|██████▎   | 127/200 [00:21<00:10,  7.10it/s]TREC:  64%|██████▍   | 129/200 [00:21<00:09,  7.45it/s]TREC:  65%|██████▌   | 130/200 [00:21<00:09,  7.18it/s]TREC:  66%|██████▌   | 131/200 [00:22<00:09,  6.97it/s]TREC:  66%|██████▌   | 132/200 [00:22<00:09,  7.21it/s]TREC:  67%|██████▋   | 134/200 [00:22<00:08,  8.14it/s]TREC:  68%|██████▊   | 135/200 [00:22<00:08,  7.68it/s]TREC:  68%|██████▊   | 136/200 [00:22<00:08,  7.34it/s]TREC:  69%|██████▉   | 138/200 [00:23<00:10,  6.10it/s]TREC:  70%|██████▉   | 139/200 [00:23<00:11,  5.15it/s]TREC:  70%|███████   | 140/200 [00:23<00:12,  4.90it/s]TREC:  70%|███████   | 141/200 [00:23<00:11,  5.22it/s]TREC:  71%|███████   | 142/200 [00:23<00:10,  5.50it/s]TREC:  72%|███████▏  | 144/200 [00:24<00:08,  6.38it/s]TREC:  72%|███████▎  | 145/200 [00:24<00:08,  6.39it/s]TREC:  73%|███████▎  | 146/200 [00:24<00:08,  6.41it/s]TREC:  74%|███████▎  | 147/200 [00:24<00:08,  6.43it/s]TREC:  74%|███████▍  | 148/200 [00:24<00:08,  6.43it/s]TREC:  74%|███████▍  | 149/200 [00:24<00:07,  6.44it/s]TREC:  75%|███████▌  | 150/200 [00:25<00:07,  6.45it/s]TREC:  76%|███████▌  | 151/200 [00:25<00:07,  6.44it/s]TREC:  76%|███████▌  | 152/200 [00:25<00:07,  6.44it/s]TREC:  76%|███████▋  | 153/200 [00:25<00:07,  6.42it/s]TREC:  77%|███████▋  | 154/200 [00:25<00:09,  4.98it/s]TREC:  78%|███████▊  | 155/200 [00:26<00:11,  4.00it/s]TREC:  78%|███████▊  | 156/200 [00:26<00:09,  4.85it/s]TREC:  78%|███████▊  | 157/200 [00:26<00:08,  5.24it/s]TREC:  79%|███████▉  | 158/200 [00:26<00:07,  5.55it/s]TREC:  80%|███████▉  | 159/200 [00:26<00:07,  5.80it/s]TREC:  80%|████████  | 161/200 [00:27<00:05,  7.17it/s]TREC:  81%|████████  | 162/200 [00:27<00:05,  6.97it/s]TREC:  82%|████████▏ | 163/200 [00:27<00:05,  6.83it/s]TREC:  82%|████████▏ | 164/200 [00:27<00:05,  6.73it/s]TREC:  82%|████████▎ | 165/200 [00:27<00:05,  6.66it/s]TREC:  83%|████████▎ | 166/200 [00:27<00:05,  6.60it/s]TREC:  84%|████████▎ | 167/200 [00:27<00:05,  6.57it/s]TREC:  84%|████████▍ | 168/200 [00:28<00:04,  6.53it/s]TREC:  84%|████████▍ | 169/200 [00:28<00:04,  6.50it/s]TREC:  85%|████████▌ | 170/200 [00:28<00:05,  5.91it/s]TREC:  86%|████████▌ | 171/200 [00:28<00:06,  4.59it/s]TREC:  86%|████████▌ | 172/200 [00:29<00:06,  4.15it/s]TREC:  86%|████████▋ | 173/200 [00:29<00:05,  4.58it/s]TREC:  87%|████████▋ | 174/200 [00:29<00:05,  5.02it/s]TREC:  88%|████████▊ | 176/200 [00:29<00:03,  6.08it/s]TREC:  89%|████████▉ | 178/200 [00:29<00:03,  6.73it/s]TREC:  90%|████████▉ | 179/200 [00:30<00:03,  6.66it/s]TREC:  90%|█████████ | 180/200 [00:30<00:03,  6.61it/s]TREC:  91%|█████████ | 182/200 [00:30<00:02,  7.14it/s]TREC:  92%|█████████▏| 184/200 [00:30<00:02,  7.44it/s]TREC:  92%|█████████▎| 185/200 [00:30<00:02,  7.21it/s]TREC:  93%|█████████▎| 186/200 [00:31<00:01,  7.00it/s]TREC:  94%|█████████▎| 187/200 [00:31<00:01,  6.82it/s]TREC:  94%|█████████▍| 188/200 [00:31<00:02,  5.20it/s]TREC:  94%|█████████▍| 189/200 [00:31<00:02,  4.53it/s]TREC:  95%|█████████▌| 190/200 [00:32<00:02,  4.45it/s]TREC:  96%|█████████▋| 193/200 [00:32<00:01,  6.77it/s]TREC:  97%|█████████▋| 194/200 [00:32<00:00,  6.70it/s]TREC:  98%|█████████▊| 195/200 [00:32<00:00,  6.64it/s]TREC:  98%|█████████▊| 197/200 [00:32<00:00,  7.61it/s]TREC:  99%|█████████▉| 198/200 [00:32<00:00,  7.31it/s]TREC: 100%|█████████▉| 199/200 [00:33<00:00,  7.10it/s]TREC: 100%|██████████| 200/200 [00:33<00:00,  6.93it/s]TREC: 100%|██████████| 200/200 [00:33<00:00,  6.01it/s]

TREC Text Baseline Accuracy: 43.0% (86/200)

Samples:
  Q: How far is it from Denver to Aspen ?... | GT: NUM | Pred: loc

explanation: th
  Q: What county is Modesto , California in ?... | GT: LOC | Pred: loc (location)
  Q: Who was Galileo ?... | GT: HUM | Pred: entity (entity)

exp
  Q: What is an atom ?... | GT: DESC | Pred: enty (entity)

expla
  Q: When did Hawaii become a state ?... | GT: NUM | Pred: enty (entity)

expla

Loading Llama...
Downloading shards:   0%|          | 0/4 [00:00<?, ?it/s]Downloading shards: 100%|██████████| 4/4 [00:00<00:00, 4025.24it/s]
Loading checkpoint shards:   0%|          | 0/4 [00:00<?, ?it/s]Loading checkpoint shards:  25%|██▌       | 1/4 [00:00<00:00,  6.51it/s]Loading checkpoint shards:  50%|█████     | 2/4 [00:00<00:00,  5.79it/s]Loading checkpoint shards:  75%|███████▌  | 3/4 [00:00<00:00,  5.38it/s]Loading checkpoint shards: 100%|██████████| 4/4 [00:00<00:00,  5.99it/s]Loading checkpoint shards: 100%|██████████| 4/4 [00:00<00:00,  5.88it/s]

============================================================
TREC TEXT BASELINE (6-class)
============================================================
Classes: 6 - ['ABBR', 'ENTY', 'DESC', 'HUM', 'LOC', 'NUM']
Test samples: 500
TREC:   0%|          | 0/200 [00:00<?, ?it/s]/users/sujinesh/.local/lib/python3.10/site-packages/transformers/generation/configuration_utils.py:590: UserWarning: `do_sample` is set to `False`. However, `temperature` is set to `0.6` -- this flag is only used in sample-based generation modes. You should set `do_sample=True` or unset `temperature`.
  warnings.warn(
/users/sujinesh/.local/lib/python3.10/site-packages/transformers/generation/configuration_utils.py:595: UserWarning: `do_sample` is set to `False`. However, `top_p` is set to `0.9` -- this flag is only used in sample-based generation modes. You should set `do_sample=True` or unset `top_p`.
  warnings.warn(
TREC:   0%|          | 1/200 [00:00<00:23,  8.32it/s]TREC:   1%|          | 2/200 [00:00<00:30,  6.55it/s]TREC:   2%|▏         | 3/200 [00:00<00:48,  4.06it/s]TREC:   2%|▏         | 4/200 [00:00<00:51,  3.80it/s]TREC:   2%|▎         | 5/200 [00:01<00:51,  3.77it/s]TREC:   3%|▎         | 6/200 [00:01<00:43,  4.50it/s]TREC:   4%|▎         | 7/200 [00:01<00:37,  5.21it/s]TREC:   4%|▍         | 8/200 [00:01<00:32,  5.82it/s]TREC:   4%|▍         | 9/200 [00:01<00:30,  6.31it/s]TREC:   5%|▌         | 10/200 [00:01<00:28,  6.71it/s]TREC:   6%|▌         | 11/200 [00:01<00:27,  6.99it/s]TREC:   6%|▌         | 12/200 [00:02<00:26,  7.21it/s]TREC:   6%|▋         | 13/200 [00:02<00:25,  7.35it/s]TREC:   7%|▋         | 14/200 [00:02<00:24,  7.47it/s]TREC:   8%|▊         | 15/200 [00:02<00:24,  7.56it/s]TREC:   8%|▊         | 16/200 [00:02<00:24,  7.62it/s]TREC:   8%|▊         | 17/200 [00:02<00:23,  7.66it/s]TREC:   9%|▉         | 18/200 [00:02<00:23,  7.69it/s]TREC:  10%|▉         | 19/200 [00:03<00:23,  7.72it/s]TREC:  10%|█         | 20/200 [00:03<00:23,  7.74it/s]TREC:  10%|█         | 21/200 [00:03<00:23,  7.75it/s]TREC:  11%|█         | 22/200 [00:03<00:31,  5.72it/s]TREC:  12%|█▏        | 23/200 [00:03<00:35,  4.92it/s]TREC:  12%|█▏        | 24/200 [00:04<00:35,  4.95it/s]TREC:  12%|█▎        | 25/200 [00:04<00:32,  5.47it/s]TREC:  13%|█▎        | 26/200 [00:04<00:29,  6.00it/s]TREC:  14%|█▎        | 27/200 [00:04<00:26,  6.44it/s]TREC:  14%|█▍        | 28/200 [00:04<00:25,  6.78it/s]TREC:  14%|█▍        | 29/200 [00:04<00:23,  7.24it/s]TREC:  15%|█▌        | 30/200 [00:04<00:23,  7.35it/s]TREC:  16%|█▌        | 31/200 [00:04<00:22,  7.38it/s]TREC:  16%|█▌        | 32/200 [00:05<00:21,  7.72it/s]TREC:  16%|█▋        | 33/200 [00:05<00:21,  7.73it/s]TREC:  17%|█▋        | 34/200 [00:05<00:21,  7.74it/s]TREC:  18%|█▊        | 35/200 [00:05<00:21,  7.75it/s]TREC:  18%|█▊        | 36/200 [00:05<00:21,  7.76it/s]TREC:  18%|█▊        | 37/200 [00:05<00:20,  8.00it/s]TREC:  19%|█▉        | 38/200 [00:05<00:20,  7.93it/s]TREC:  20%|█▉        | 39/200 [00:05<00:20,  7.68it/s]TREC:  20%|██        | 40/200 [00:06<00:22,  7.12it/s]TREC:  20%|██        | 41/200 [00:06<00:29,  5.35it/s]TREC:  21%|██        | 42/200 [00:06<00:33,  4.72it/s]TREC:  22%|██▏       | 43/200 [00:06<00:33,  4.73it/s]TREC:  22%|██▏       | 44/200 [00:07<00:29,  5.36it/s]TREC:  22%|██▎       | 45/200 [00:07<00:26,  5.91it/s]TREC:  23%|██▎       | 46/200 [00:07<00:24,  6.37it/s]TREC:  24%|██▎       | 47/200 [00:07<00:22,  6.73it/s]TREC:  24%|██▍       | 48/200 [00:07<00:21,  7.02it/s]TREC:  24%|██▍       | 49/200 [00:07<00:20,  7.23it/s]TREC:  25%|██▌       | 50/200 [00:07<00:20,  7.38it/s]TREC:  26%|██▌       | 51/200 [00:07<00:19,  7.49it/s]TREC:  26%|██▌       | 52/200 [00:08<00:19,  7.58it/s]TREC:  26%|██▋       | 53/200 [00:08<00:19,  7.63it/s]TREC:  27%|██▋       | 54/200 [00:08<00:19,  7.68it/s]TREC:  28%|██▊       | 55/200 [00:08<00:18,  7.71it/s]TREC:  28%|██▊       | 56/200 [00:08<00:18,  7.73it/s]TREC:  28%|██▊       | 57/200 [00:08<00:18,  7.75it/s]TREC:  29%|██▉       | 58/200 [00:08<00:18,  7.75it/s]TREC:  30%|██▉       | 59/200 [00:08<00:17,  7.92it/s]TREC:  30%|███       | 60/200 [00:09<00:24,  5.79it/s]TREC:  30%|███       | 61/200 [00:09<00:28,  4.96it/s]TREC:  31%|███       | 62/200 [00:09<00:28,  4.90it/s]TREC:  32%|███▏      | 63/200 [00:09<00:24,  5.63it/s]TREC:  32%|███▏      | 64/200 [00:09<00:22,  6.14it/s]TREC:  32%|███▎      | 65/200 [00:10<00:20,  6.56it/s]TREC:  33%|███▎      | 66/200 [00:10<00:19,  6.87it/s]TREC:  34%|███▎      | 67/200 [00:10<00:18,  7.12it/s]TREC:  34%|███▍      | 68/200 [00:10<00:18,  7.30it/s]TREC:  34%|███▍      | 69/200 [00:10<00:17,  7.43it/s]TREC:  35%|███▌      | 70/200 [00:10<00:17,  7.53it/s]TREC:  36%|███▌      | 71/200 [00:10<00:16,  7.60it/s]TREC:  36%|███▌      | 72/200 [00:10<00:16,  7.65it/s]TREC:  36%|███▋      | 73/200 [00:11<00:16,  7.69it/s]TREC:  37%|███▋      | 74/200 [00:11<00:16,  7.70it/s]TREC:  38%|███▊      | 75/200 [00:11<00:15,  7.96it/s]TREC:  38%|███▊      | 76/200 [00:11<00:15,  7.91it/s]TREC:  38%|███▊      | 77/200 [00:11<00:15,  7.87it/s]TREC:  39%|███▉      | 78/200 [00:11<00:15,  7.68it/s]TREC:  40%|███▉      | 79/200 [00:11<00:18,  6.57it/s]TREC:  40%|████      | 80/200 [00:12<00:22,  5.31it/s]TREC:  40%|████      | 81/200 [00:12<00:25,  4.69it/s]TREC:  41%|████      | 82/200 [00:12<00:22,  5.23it/s]TREC:  42%|████▏     | 83/200 [00:12<00:20,  5.80it/s]TREC:  42%|████▏     | 84/200 [00:12<00:18,  6.28it/s]TREC:  42%|████▎     | 85/200 [00:13<00:17,  6.67it/s]TREC:  43%|████▎     | 86/200 [00:13<00:16,  6.97it/s]TREC:  44%|████▎     | 87/200 [00:13<00:15,  7.19it/s]TREC:  44%|████▍     | 88/200 [00:13<00:15,  7.35it/s]TREC:  44%|████▍     | 89/200 [00:13<00:14,  7.47it/s]TREC:  45%|████▌     | 90/200 [00:13<00:14,  7.56it/s]TREC:  46%|████▌     | 91/200 [00:13<00:14,  7.62it/s]TREC:  46%|████▌     | 92/200 [00:13<00:14,  7.66it/s]TREC:  46%|████▋     | 93/200 [00:14<00:13,  7.71it/s]TREC:  47%|████▋     | 94/200 [00:14<00:13,  7.74it/s]TREC:  48%|████▊     | 95/200 [00:14<00:13,  7.75it/s]TREC:  48%|████▊     | 96/200 [00:14<00:13,  7.99it/s]TREC:  48%|████▊     | 97/200 [00:14<00:13,  7.92it/s]TREC:  49%|████▉     | 98/200 [00:14<00:14,  6.98it/s]TREC:  50%|████▉     | 99/200 [00:15<00:19,  5.22it/s]TREC:  50%|█████     | 100/200 [00:15<00:21,  4.64it/s]TREC:  50%|█████     | 101/200 [00:15<00:19,  5.20it/s]TREC:  51%|█████     | 102/200 [00:15<00:16,  5.77it/s]TREC:  52%|█████▏    | 103/200 [00:15<00:15,  6.26it/s]TREC:  52%|█████▏    | 104/200 [00:15<00:14,  6.65it/s]TREC:  52%|█████▎    | 105/200 [00:15<00:13,  6.95it/s]TREC:  53%|█████▎    | 106/200 [00:16<00:13,  7.18it/s]TREC:  54%|█████▎    | 107/200 [00:16<00:12,  7.35it/s]TREC:  54%|█████▍    | 108/200 [00:16<00:12,  7.47it/s]TREC:  55%|█████▍    | 109/200 [00:16<00:12,  7.56it/s]TREC:  55%|█████▌    | 110/200 [00:16<00:11,  7.63it/s]TREC:  56%|█████▌    | 111/200 [00:16<00:11,  7.67it/s]TREC:  56%|█████▌    | 112/200 [00:16<00:11,  7.71it/s]TREC:  56%|█████▋    | 113/200 [00:16<00:11,  7.74it/s]TREC:  57%|█████▋    | 114/200 [00:17<00:11,  7.75it/s]TREC:  57%|█████▊    | 115/200 [00:17<00:10,  7.77it/s]TREC:  58%|█████▊    | 116/200 [00:17<00:10,  7.78it/s]TREC:  58%|█████▊    | 117/200 [00:17<00:12,  6.50it/s]TREC:  59%|█████▉    | 118/200 [00:17<00:15,  5.30it/s]TREC:  60%|█████▉    | 119/200 [00:18<00:17,  4.69it/s]TREC:  60%|██████    | 120/200 [00:18<00:14,  5.36it/s]TREC:  60%|██████    | 121/200 [00:18<00:13,  5.91it/s]TREC:  61%|██████    | 122/200 [00:18<00:12,  6.36it/s]TREC:  62%|██████▏   | 123/200 [00:18<00:11,  6.73it/s]TREC:  62%|██████▏   | 124/200 [00:18<00:10,  7.00it/s]TREC:  62%|██████▎   | 125/200 [00:18<00:10,  7.20it/s]TREC:  63%|██████▎   | 126/200 [00:19<00:10,  7.36it/s]TREC:  64%|██████▎   | 127/200 [00:19<00:09,  7.48it/s]TREC:  64%|██████▍   | 128/200 [00:19<00:09,  7.56it/s]TREC:  64%|██████▍   | 129/200 [00:19<00:09,  7.62it/s]TREC:  65%|██████▌   | 130/200 [00:19<00:09,  7.67it/s]TREC:  66%|██████▌   | 131/200 [00:19<00:08,  7.70it/s]TREC:  66%|██████▌   | 132/200 [00:19<00:08,  7.71it/s]TREC:  66%|██████▋   | 133/200 [00:19<00:08,  7.73it/s]TREC:  67%|██████▋   | 134/200 [00:20<00:08,  7.74it/s]TREC:  68%|██████▊   | 135/200 [00:20<00:08,  7.74it/s]TREC:  68%|██████▊   | 136/200 [00:20<00:11,  5.70it/s]TREC:  68%|██████▊   | 137/200 [00:20<00:12,  5.00it/s]TREC:  69%|██████▉   | 138/200 [00:20<00:12,  5.00it/s]TREC:  70%|██████▉   | 139/200 [00:21<00:11,  5.51it/s]TREC:  70%|███████   | 140/200 [00:21<00:09,  6.04it/s]TREC:  70%|███████   | 141/200 [00:21<00:09,  6.47it/s]TREC:  71%|███████   | 142/200 [00:21<00:08,  6.82it/s]TREC:  72%|███████▏  | 143/200 [00:21<00:07,  7.28it/s]TREC:  72%|███████▏  | 144/200 [00:21<00:07,  7.43it/s]TREC:  72%|███████▎  | 145/200 [00:21<00:07,  7.52it/s]TREC:  73%|███████▎  | 146/200 [00:21<00:07,  7.59it/s]TREC:  74%|███████▎  | 147/200 [00:22<00:06,  7.65it/s]TREC:  74%|███████▍  | 148/200 [00:22<00:06,  7.69it/s]TREC:  74%|███████▍  | 149/200 [00:22<00:06,  7.71it/s]TREC:  75%|███████▌  | 150/200 [00:22<00:06,  7.72it/s]TREC:  76%|███████▌  | 151/200 [00:22<00:06,  7.73it/s]TREC:  76%|███████▌  | 152/200 [00:22<00:06,  7.76it/s]TREC:  76%|███████▋  | 153/200 [00:22<00:06,  7.76it/s]TREC:  77%|███████▋  | 154/200 [00:22<00:05,  7.74it/s]TREC:  78%|███████▊  | 155/200 [00:23<00:07,  5.71it/s]TREC:  78%|███████▊  | 156/200 [00:23<00:08,  4.91it/s]TREC:  78%|███████▊  | 157/200 [00:23<00:08,  4.87it/s]TREC:  79%|███████▉  | 158/200 [00:23<00:07,  5.49it/s]TREC:  80%|███████▉  | 159/200 [00:24<00:06,  6.02it/s]TREC:  80%|████████  | 160/200 [00:24<00:06,  6.46it/s]TREC:  80%|████████  | 161/200 [00:24<00:05,  6.81it/s]TREC:  81%|████████  | 162/200 [00:24<00:05,  7.08it/s]TREC:  82%|████████▏ | 163/200 [00:24<00:05,  7.28it/s]TREC:  82%|████████▏ | 164/200 [00:24<00:04,  7.64it/s]TREC:  82%|████████▎ | 165/200 [00:24<00:04,  7.67it/s]TREC:  83%|████████▎ | 166/200 [00:24<00:04,  7.70it/s]TREC:  84%|████████▎ | 167/200 [00:25<00:04,  7.71it/s]TREC:  84%|████████▍ | 168/200 [00:25<00:04,  7.73it/s]TREC:  84%|████████▍ | 169/200 [00:25<00:03,  7.76it/s]TREC:  85%|████████▌ | 170/200 [00:25<00:03,  7.78it/s]TREC:  86%|████████▌ | 171/200 [00:25<00:03,  7.78it/s]TREC:  86%|████████▌ | 172/200 [00:25<00:03,  7.79it/s]TREC:  86%|████████▋ | 173/200 [00:25<00:03,  7.72it/s]TREC:  87%|████████▋ | 174/200 [00:26<00:04,  5.73it/s]TREC:  88%|████████▊ | 175/200 [00:26<00:04,  5.02it/s]TREC:  88%|████████▊ | 176/200 [00:26<00:04,  5.02it/s]TREC:  88%|████████▊ | 177/200 [00:26<00:04,  5.64it/s]TREC:  89%|████████▉ | 178/200 [00:26<00:03,  6.14it/s]TREC:  90%|████████▉ | 179/200 [00:26<00:03,  6.56it/s]TREC:  90%|█████████ | 180/200 [00:27<00:02,  6.88it/s]TREC:  90%|█████████ | 181/200 [00:27<00:02,  7.13it/s]TREC:  91%|█████████ | 182/200 [00:27<00:02,  7.31it/s]TREC:  92%|█████████▏| 183/200 [00:27<00:02,  7.66it/s]TREC:  92%|█████████▏| 184/200 [00:27<00:02,  7.69it/s]TREC:  92%|█████████▎| 185/200 [00:27<00:01,  7.71it/s]TREC:  93%|█████████▎| 186/200 [00:27<00:01,  7.72it/s]TREC:  94%|█████████▎| 187/200 [00:27<00:01,  7.73it/s]TREC:  94%|█████████▍| 188/200 [00:28<00:01,  7.75it/s]TREC:  94%|█████████▍| 189/200 [00:28<00:01,  7.76it/s]TREC:  95%|█████████▌| 190/200 [00:28<00:01,  7.77it/s]TREC:  96%|█████████▌| 191/200 [00:28<00:01,  7.77it/s]TREC:  96%|█████████▌| 192/200 [00:28<00:01,  7.73it/s]TREC:  96%|█████████▋| 193/200 [00:28<00:01,  5.71it/s]TREC:  97%|█████████▋| 194/200 [00:29<00:01,  4.92it/s]TREC:  98%|█████████▊| 195/200 [00:29<00:01,  4.95it/s]TREC:  98%|█████████▊| 196/200 [00:29<00:00,  5.59it/s]TREC:  98%|█████████▊| 197/200 [00:29<00:00,  6.11it/s]TREC:  99%|█████████▉| 198/200 [00:29<00:00,  6.54it/s]TREC: 100%|█████████▉| 199/200 [00:29<00:00,  6.87it/s]TREC: 100%|██████████| 200/200 [00:29<00:00,  7.11it/s]TREC: 100%|██████████| 200/200 [00:29<00:00,  6.68it/s]

TREC Text Baseline Accuracy: 53.5% (107/200)

Samples:
  Q: How far is it from Denver to Aspen ?... | GT: NUM | Pred: loc
the best answer 
  Q: What county is Modesto , California in ?... | GT: LOC | Pred: loc
the best answer 
  Q: Who was Galileo ?... | GT: HUM | Pred: enty
the best answer
  Q: What is an atom ?... | GT: DESC | Pred: desc
answer: a tiny 
  Q: When did Hawaii become a state ?... | GT: NUM | Pred: desc
the question is

============================================================
TREC TEXT BASELINES SUMMARY
============================================================
Mistral Text: 43.0%
Llama Text:   53.5%
Bridge (16 tokens): 94.5%
Random (6 classes): 16.7%
============================================================

Results saved to: runs/trec_baselines_20251213_155637/trec_baselines.json

=== PART 2: TREC TEXT-RELAY ===
/users/sujinesh/.local/lib/python3.10/site-packages/transformers/utils/hub.py:128: FutureWarning: Using `TRANSFORMERS_CACHE` is deprecated and will be removed in v5 of Transformers. Use `HF_HOME` instead.
  warnings.warn(
Using GPU 0 (4 available): cuda:0
============================================================
TREC TEXT-RELAY BASELINE (6-class)
============================================================
Pipeline: Llama summarizes → text → Mistral classifies
Llama: meta-llama/Meta-Llama-3.1-8B-Instruct
Mistral: mistralai/Mistral-7B-Instruct-v0.3
============================================================

Loading Llama...
Downloading shards:   0%|          | 0/4 [00:00<?, ?it/s]Downloading shards: 100%|██████████| 4/4 [00:00<00:00, 8816.19it/s]
Loading checkpoint shards:   0%|          | 0/4 [00:00<?, ?it/s]Loading checkpoint shards:  25%|██▌       | 1/4 [00:00<00:00,  7.23it/s]Loading checkpoint shards:  50%|█████     | 2/4 [00:00<00:00,  5.69it/s]Loading checkpoint shards: 100%|██████████| 4/4 [00:00<00:00,  9.51it/s]Loading checkpoint shards: 100%|██████████| 4/4 [00:00<00:00,  8.57it/s]
Loading Mistral...
Downloading shards:   0%|          | 0/3 [00:00<?, ?it/s]Downloading shards: 100%|██████████| 3/3 [00:00<00:00, 4086.69it/s]
Loading checkpoint shards:   0%|          | 0/3 [00:00<?, ?it/s]Loading checkpoint shards:  33%|███▎      | 1/3 [00:00<00:00,  8.96it/s]Loading checkpoint shards:  67%|██████▋   | 2/3 [00:00<00:00,  9.00it/s]Loading checkpoint shards: 100%|██████████| 3/3 [00:00<00:00,  6.93it/s]Loading checkpoint shards: 100%|██████████| 3/3 [00:00<00:00,  7.38it/s]

============================================================
TREC TEXT-RELAY BASELINE (6-class)
============================================================
Pipeline: Llama summarizes question → text → Mistral classifies type
============================================================
Classes: 6 - ['ABBR', 'ENTY', 'DESC', 'HUM', 'LOC', 'NUM']
Test samples: 500
TREC Relay:   0%|          | 0/200 [00:00<?, ?it/s]/users/sujinesh/.local/lib/python3.10/site-packages/transformers/generation/configuration_utils.py:590: UserWarning: `do_sample` is set to `False`. However, `temperature` is set to `0.6` -- this flag is only used in sample-based generation modes. You should set `do_sample=True` or unset `temperature`.
  warnings.warn(
/users/sujinesh/.local/lib/python3.10/site-packages/transformers/generation/configuration_utils.py:595: UserWarning: `do_sample` is set to `False`. However, `top_p` is set to `0.9` -- this flag is only used in sample-based generation modes. You should set `do_sample=True` or unset `top_p`.
  warnings.warn(
TREC Relay:   0%|          | 1/200 [00:00<02:57,  1.12it/s]TREC Relay:   1%|          | 2/200 [00:01<03:07,  1.05it/s]TREC Relay:   2%|▏         | 3/200 [00:02<02:35,  1.27it/s]TREC Relay:   2%|▏         | 4/200 [00:03<02:20,  1.40it/s]TREC Relay:   2%|▎         | 5/200 [00:03<02:15,  1.44it/s]TREC Relay:   3%|▎         | 6/200 [00:04<02:34,  1.26it/s]TREC Relay:   4%|▎         | 7/200 [00:05<02:21,  1.37it/s]TREC Relay:   4%|▍         | 8/200 [00:05<02:12,  1.45it/s]TREC Relay:   4%|▍         | 9/200 [00:06<02:03,  1.54it/s]TREC Relay:   5%|▌         | 10/200 [00:07<02:22,  1.33it/s]TREC Relay:   6%|▌         | 11/200 [00:08<02:10,  1.44it/s]TREC Relay:   6%|▌         | 12/200 [00:08<02:02,  1.54it/s]TREC Relay:   6%|▋         | 13/200 [00:09<02:02,  1.53it/s]TREC Relay:   7%|▋         | 14/200 [00:10<02:20,  1.33it/s]TREC Relay:   8%|▊         | 15/200 [00:10<02:13,  1.38it/s]TREC Relay:   8%|▊         | 16/200 [00:11<02:06,  1.46it/s]TREC Relay:   8%|▊         | 17/200 [00:12<02:03,  1.48it/s]TREC Relay:   9%|▉         | 18/200 [00:13<02:23,  1.27it/s]TREC Relay:  10%|▉         | 19/200 [00:13<02:09,  1.39it/s]TREC Relay:  10%|█         | 20/200 [00:14<02:15,  1.33it/s]TREC Relay:  10%|█         | 21/200 [00:15<02:06,  1.42it/s]TREC Relay:  11%|█         | 22/200 [00:16<02:18,  1.29it/s]TREC Relay:  12%|█▏        | 23/200 [00:16<02:11,  1.34it/s]TREC Relay:  12%|█▏        | 24/200 [00:17<02:03,  1.43it/s]TREC Relay:  12%|█▎        | 25/200 [00:18<01:58,  1.47it/s]TREC Relay:  13%|█▎        | 26/200 [00:18<02:13,  1.30it/s]TREC Relay:  14%|█▎        | 27/200 [00:19<02:02,  1.42it/s]TREC Relay:  14%|█▍        | 28/200 [00:20<01:56,  1.48it/s]TREC Relay:  14%|█▍        | 29/200 [00:20<01:49,  1.56it/s]TREC Relay:  15%|█▌        | 30/200 [00:21<02:06,  1.35it/s]TREC Relay:  16%|█▌        | 31/200 [00:22<01:56,  1.46it/s]TREC Relay:  16%|█▌        | 32/200 [00:22<01:48,  1.54it/s]TREC Relay:  16%|█▋        | 33/200 [00:23<01:45,  1.58it/s]TREC Relay:  17%|█▋        | 34/200 [00:24<01:59,  1.39it/s]TREC Relay:  18%|█▊        | 35/200 [00:25<01:56,  1.41it/s]TREC Relay:  18%|█▊        | 36/200 [00:25<01:48,  1.51it/s]TREC Relay:  18%|█▊        | 37/200 [00:26<01:44,  1.55it/s]TREC Relay:  19%|█▉        | 38/200 [00:27<01:58,  1.37it/s]TREC Relay:  20%|█▉        | 39/200 [00:27<01:49,  1.47it/s]TREC Relay:  20%|██        | 40/200 [00:28<01:45,  1.52it/s]TREC Relay:  20%|██        | 41/200 [00:28<01:42,  1.56it/s]TREC Relay:  21%|██        | 42/200 [00:29<01:59,  1.32it/s]TREC Relay:  22%|██▏       | 43/200 [00:30<01:52,  1.40it/s]TREC Relay:  22%|██▏       | 44/200 [00:31<01:46,  1.47it/s]TREC Relay:  22%|██▎       | 45/200 [00:31<01:42,  1.51it/s]TREC Relay:  23%|██▎       | 46/200 [00:32<01:59,  1.28it/s]TREC Relay:  24%|██▎       | 47/200 [00:33<01:54,  1.34it/s]TREC Relay:  24%|██▍       | 48/200 [00:34<01:49,  1.38it/s]TREC Relay:  24%|██▍       | 49/200 [00:34<01:43,  1.46it/s]TREC Relay:  25%|██▌       | 50/200 [00:35<01:58,  1.26it/s]TREC Relay:  26%|██▌       | 51/200 [00:36<01:49,  1.36it/s]TREC Relay:  26%|██▌       | 52/200 [00:37<01:45,  1.40it/s]TREC Relay:  26%|██▋       | 53/200 [00:37<01:37,  1.50it/s]TREC Relay:  27%|██▋       | 54/200 [00:38<01:48,  1.34it/s]TREC Relay:  28%|██▊       | 55/200 [00:39<01:40,  1.45it/s]TREC Relay:  28%|██▊       | 56/200 [00:39<01:33,  1.54it/s]TREC Relay:  28%|██▊       | 57/200 [00:40<01:33,  1.53it/s]TREC Relay:  29%|██▉       | 58/200 [00:41<01:46,  1.33it/s]TREC Relay:  30%|██▉       | 59/200 [00:41<01:39,  1.41it/s]TREC Relay:  30%|███       | 60/200 [00:42<01:37,  1.44it/s]TREC Relay:  30%|███       | 61/200 [00:43<01:30,  1.53it/s]TREC Relay:  31%|███       | 62/200 [00:44<01:43,  1.33it/s]TREC Relay:  32%|███▏      | 63/200 [00:44<01:44,  1.31it/s]TREC Relay:  32%|███▏      | 64/200 [00:45<01:37,  1.40it/s]TREC Relay:  32%|███▎      | 65/200 [00:46<01:30,  1.50it/s]TREC Relay:  33%|███▎      | 66/200 [00:47<01:41,  1.31it/s]TREC Relay:  34%|███▎      | 67/200 [00:47<01:37,  1.37it/s]TREC Relay:  34%|███▍      | 68/200 [00:48<01:29,  1.47it/s]TREC Relay:  34%|███▍      | 69/200 [00:48<01:28,  1.48it/s]TREC Relay:  35%|███▌      | 70/200 [00:49<01:39,  1.30it/s]TREC Relay:  36%|███▌      | 71/200 [00:50<01:30,  1.42it/s]TREC Relay:  36%|███▌      | 72/200 [00:51<01:24,  1.51it/s]TREC Relay:  36%|███▋      | 73/200 [00:51<01:26,  1.46it/s]TREC Relay:  37%|███▋      | 74/200 [00:52<01:36,  1.30it/s]TREC Relay:  38%|███▊      | 75/200 [00:53<01:29,  1.39it/s]TREC Relay:  38%|███▊      | 76/200 [00:53<01:22,  1.50it/s]TREC Relay:  38%|███▊      | 77/200 [00:54<01:24,  1.46it/s]TREC Relay:  39%|███▉      | 78/200 [00:55<01:32,  1.32it/s]TREC Relay:  40%|███▉      | 79/200 [00:56<01:26,  1.41it/s]TREC Relay:  40%|████      | 80/200 [00:56<01:23,  1.43it/s]TREC Relay:  40%|████      | 81/200 [00:57<01:22,  1.45it/s]TREC Relay:  41%|████      | 82/200 [00:58<01:29,  1.32it/s]TREC Relay:  42%|████▏     | 83/200 [00:58<01:23,  1.41it/s]TREC Relay:  42%|████▏     | 84/200 [00:59<01:18,  1.47it/s]TREC Relay:  42%|████▎     | 85/200 [01:00<01:18,  1.47it/s]TREC Relay:  43%|████▎     | 86/200 [01:01<01:25,  1.34it/s]TREC Relay:  44%|████▎     | 87/200 [01:01<01:21,  1.38it/s]TREC Relay:  44%|████▍     | 88/200 [01:02<01:17,  1.45it/s]TREC Relay:  44%|████▍     | 89/200 [01:03<01:19,  1.40it/s]TREC Relay:  45%|████▌     | 90/200 [01:04<01:22,  1.34it/s]TREC Relay:  46%|████▌     | 91/200 [01:04<01:16,  1.42it/s]TREC Relay:  46%|████▌     | 92/200 [01:05<01:12,  1.48it/s]TREC Relay:  46%|████▋     | 93/200 [01:06<01:15,  1.42it/s]TREC Relay:  47%|████▋     | 94/200 [01:06<01:17,  1.38it/s]TREC Relay:  48%|████▊     | 95/200 [01:07<01:14,  1.41it/s]TREC Relay:  48%|████▊     | 96/200 [01:08<01:08,  1.51it/s]TREC Relay:  48%|████▊     | 97/200 [01:08<01:06,  1.54it/s]TREC Relay:  49%|████▉     | 98/200 [01:09<01:16,  1.33it/s]TREC Relay:  50%|████▉     | 99/200 [01:10<01:09,  1.44it/s]TREC Relay:  50%|█████     | 100/200 [01:10<01:08,  1.46it/s]TREC Relay:  50%|█████     | 101/200 [01:11<01:10,  1.41it/s]TREC Relay:  51%|█████     | 102/200 [01:12<01:11,  1.37it/s]TREC Relay:  52%|█████▏    | 103/200 [01:12<01:05,  1.48it/s]TREC Relay:  52%|█████▏    | 104/200 [01:13<01:01,  1.56it/s]TREC Relay:  52%|█████▎    | 105/200 [01:14<00:59,  1.58it/s]TREC Relay:  53%|█████▎    | 106/200 [01:15<01:14,  1.27it/s]TREC Relay:  54%|█████▎    | 107/200 [01:15<01:08,  1.36it/s]TREC Relay:  54%|█████▍    | 108/200 [01:16<01:05,  1.40it/s]TREC Relay:  55%|█████▍    | 109/200 [01:17<01:05,  1.39it/s]TREC Relay:  55%|█████▌    | 110/200 [01:18<01:11,  1.26it/s]TREC Relay:  56%|█████▌    | 111/200 [01:18<01:05,  1.35it/s]TREC Relay:  56%|█████▌    | 112/200 [01:19<01:01,  1.43it/s]TREC Relay:  56%|█████▋    | 113/200 [01:20<01:02,  1.39it/s]TREC Relay:  57%|█████▋    | 114/200 [01:21<01:06,  1.30it/s]TREC Relay:  57%|█████▊    | 115/200 [01:21<01:01,  1.39it/s]TREC Relay:  58%|█████▊    | 116/200 [01:22<01:00,  1.39it/s]TREC Relay:  58%|█████▊    | 117/200 [01:23<01:04,  1.29it/s]TREC Relay:  59%|█████▉    | 118/200 [01:24<01:03,  1.30it/s]TREC Relay:  60%|█████▉    | 119/200 [01:24<00:57,  1.42it/s]TREC Relay:  60%|██████    | 120/200 [01:25<00:52,  1.51it/s]TREC Relay:  60%|██████    | 121/200 [01:26<00:59,  1.32it/s]TREC Relay:  61%|██████    | 122/200 [01:26<00:57,  1.36it/s]TREC Relay:  62%|██████▏   | 123/200 [01:27<00:52,  1.47it/s]TREC Relay:  62%|██████▏   | 124/200 [01:28<00:50,  1.52it/s]TREC Relay:  62%|██████▎   | 125/200 [01:28<00:53,  1.41it/s]TREC Relay:  63%|██████▎   | 126/200 [01:29<00:53,  1.38it/s]TREC Relay:  64%|██████▎   | 127/200 [01:30<00:50,  1.45it/s]TREC Relay:  64%|██████▍   | 128/200 [01:30<00:47,  1.51it/s]TREC Relay:  64%|██████▍   | 129/200 [01:31<00:50,  1.40it/s]TREC Relay:  65%|██████▌   | 130/200 [01:32<00:50,  1.38it/s]TREC Relay:  66%|██████▌   | 131/200 [01:33<00:48,  1.41it/s]TREC Relay:  66%|██████▌   | 132/200 [01:33<00:46,  1.48it/s]TREC Relay:  66%|██████▋   | 133/200 [01:34<00:47,  1.41it/s]TREC Relay:  67%|██████▋   | 134/200 [01:35<00:48,  1.35it/s]TREC Relay:  68%|██████▊   | 135/200 [01:35<00:45,  1.43it/s]TREC Relay:  68%|██████▊   | 136/200 [01:36<00:42,  1.52it/s]TREC Relay:  68%|██████▊   | 137/200 [01:37<00:42,  1.48it/s]TREC Relay:  69%|██████▉   | 138/200 [01:38<00:45,  1.35it/s]TREC Relay:  70%|██████▉   | 139/200 [01:38<00:43,  1.39it/s]TREC Relay:  70%|███████   | 140/200 [01:39<00:41,  1.46it/s]TREC Relay:  70%|███████   | 141/200 [01:40<00:42,  1.40it/s]TREC Relay:  71%|███████   | 142/200 [01:40<00:42,  1.37it/s]TREC Relay:  72%|███████▏  | 143/200 [01:41<00:38,  1.48it/s]TREC Relay:  72%|███████▏  | 144/200 [01:42<00:37,  1.49it/s]TREC Relay:  72%|███████▎  | 145/200 [01:42<00:38,  1.42it/s]TREC Relay:  73%|███████▎  | 146/200 [01:43<00:38,  1.39it/s]TREC Relay:  74%|███████▎  | 147/200 [01:44<00:36,  1.45it/s]TREC Relay:  74%|███████▍  | 148/200 [01:44<00:36,  1.42it/s]TREC Relay:  74%|███████▍  | 149/200 [01:45<00:40,  1.27it/s]TREC Relay:  75%|███████▌  | 150/200 [01:46<00:36,  1.36it/s]TREC Relay:  76%|███████▌  | 151/200 [01:47<00:35,  1.37it/s]TREC Relay:  76%|███████▌  | 152/200 [01:47<00:33,  1.45it/s]TREC Relay:  76%|███████▋  | 153/200 [01:48<00:35,  1.31it/s]TREC Relay:  77%|███████▋  | 154/200 [01:49<00:33,  1.36it/s]TREC Relay:  78%|███████▊  | 155/200 [01:50<00:31,  1.44it/s]TREC Relay:  78%|███████▊  | 156/200 [01:50<00:29,  1.50it/s]TREC Relay:  78%|███████▊  | 157/200 [01:51<00:32,  1.34it/s]TREC Relay:  79%|███████▉  | 158/200 [01:52<00:30,  1.38it/s]TREC Relay:  80%|███████▉  | 159/200 [01:53<00:29,  1.38it/s]TREC Relay:  80%|████████  | 160/200 [01:53<00:27,  1.45it/s]TREC Relay:  80%|████████  | 161/200 [01:54<00:29,  1.31it/s]TREC Relay:  81%|████████  | 162/200 [01:55<00:27,  1.40it/s]TREC Relay:  82%|████████▏ | 163/200 [01:55<00:24,  1.50it/s]TREC Relay:  82%|████████▏ | 164/200 [01:56<00:22,  1.57it/s]TREC Relay:  82%|████████▎ | 165/200 [01:57<00:25,  1.37it/s]TREC Relay:  83%|████████▎ | 166/200 [01:57<00:23,  1.47it/s]TREC Relay:  84%|████████▎ | 167/200 [01:58<00:22,  1.48it/s]TREC Relay:  84%|████████▍ | 168/200 [01:59<00:21,  1.47it/s]TREC Relay:  84%|████████▍ | 169/200 [02:00<00:24,  1.29it/s]TREC Relay:  85%|████████▌ | 170/200 [02:00<00:21,  1.41it/s]TREC Relay:  86%|████████▌ | 171/200 [02:01<00:19,  1.47it/s]TREC Relay:  86%|████████▌ | 172/200 [02:01<00:17,  1.56it/s]TREC Relay:  86%|████████▋ | 173/200 [02:02<00:19,  1.41it/s]TREC Relay:  87%|████████▋ | 174/200 [02:03<00:17,  1.46it/s]TREC Relay:  88%|████████▊ | 175/200 [02:03<00:16,  1.54it/s]TREC Relay:  88%|████████▊ | 176/200 [02:04<00:15,  1.58it/s]TREC Relay:  88%|████████▊ | 177/200 [02:05<00:14,  1.57it/s]TREC Relay:  89%|████████▉ | 178/200 [02:06<00:15,  1.42it/s]TREC Relay:  90%|████████▉ | 179/200 [02:06<00:14,  1.45it/s]TREC Relay:  90%|█████████ | 180/200 [02:07<00:13,  1.50it/s]TREC Relay:  90%|█████████ | 181/200 [02:08<00:13,  1.44it/s]TREC Relay:  91%|█████████ | 182/200 [02:08<00:13,  1.36it/s]TREC Relay:  92%|█████████▏| 183/200 [02:09<00:11,  1.47it/s]TREC Relay:  92%|█████████▏| 184/200 [02:10<00:10,  1.48it/s]TREC Relay:  92%|█████████▎| 185/200 [02:11<00:11,  1.35it/s]TREC Relay:  93%|█████████▎| 186/200 [02:11<00:10,  1.31it/s]TREC Relay:  94%|█████████▎| 187/200 [02:12<00:09,  1.36it/s]TREC Relay:  94%|█████████▍| 188/200 [02:13<00:08,  1.47it/s]TREC Relay:  94%|█████████▍| 189/200 [02:13<00:08,  1.34it/s]TREC Relay:  95%|█████████▌| 190/200 [02:14<00:07,  1.27it/s]TREC Relay:  96%|█████████▌| 191/200 [02:15<00:06,  1.34it/s]TREC Relay:  96%|█████████▌| 192/200 [02:16<00:05,  1.45it/s]TREC Relay:  96%|█████████▋| 193/200 [02:17<00:05,  1.26it/s]TREC Relay:  97%|█████████▋| 194/200 [02:17<00:04,  1.35it/s]TREC Relay:  98%|█████████▊| 195/200 [02:18<00:03,  1.46it/s]TREC Relay:  98%|█████████▊| 196/200 [02:18<00:02,  1.55it/s]TREC Relay:  98%|█████████▊| 197/200 [02:19<00:02,  1.31it/s]TREC Relay:  99%|█████████▉| 198/200 [02:20<00:01,  1.42it/s]TREC Relay: 100%|█████████▉| 199/200 [02:21<00:00,  1.45it/s]TREC Relay: 100%|██████████| 200/200 [02:21<00:00,  1.46it/s]TREC Relay: 100%|██████████| 200/200 [02:21<00:00,  1.41it/s]

TREC Text-Relay Accuracy: 58.0% (116/200)

Samples:
  Q: How far is it from Denver to Aspen ?...
  Summary: The distance from Denver to Aspen is approximately...
  GT: NUM | Pred: num, num

  Q: What county is Modesto , California in ?...
  Summary: Modesto is in Stanislaus County, California. ## St...
  GT: LOC | Pred: loc (location)

  Q: Who was Galileo ?...
  Summary: Galileo Galilei was an Italian astronomer, physici...
  GT: HUM | Pred: hum (human)

  Q: What is an atom ?...
  Summary: An atom is the smallest unit of a chemical element...
  GT: DESC | Pred: enty (entity)

  Q: When did Hawaii become a state ?...
  Summary: Hawaii became a state on August 21, 1959.

Note: T...
  GT: NUM | Pred: date (date)

## expl


============================================================
TREC COMPARISON SUMMARY
============================================================
Text-Relay (Llama→text→Mistral): 58.0%
Bridge (16 tokens):              94.5%
Random (6 classes):              16.7%
============================================================

Results saved to: runs/trec_baselines_20251213_155637/trec_relay_results.json
