/users/sujinesh/.local/lib/python3.10/site-packages/transformers/utils/hub.py:128: FutureWarning: Using `TRANSFORMERS_CACHE` is deprecated and will be removed in v5 of Transformers. Use `HF_HOME` instead.
  warnings.warn(
============================================================
SST-2 BASELINES
============================================================
These baselines tell us if 93.46% bridge accuracy is real.

Dataset: 872 samples
  Positive: 444 (50.9%)
  Negative: 428 (49.1%)
  Majority class baseline: 50.9%

Loading Mistral...
Downloading shards:   0%|          | 0/3 [00:00<?, ?it/s]Downloading shards: 100%|██████████| 3/3 [00:00<00:00, 3619.94it/s]
Loading checkpoint shards:   0%|          | 0/3 [00:00<?, ?it/s]Loading checkpoint shards:  33%|███▎      | 1/3 [00:01<00:02,  1.42s/it]Loading checkpoint shards:  67%|██████▋   | 2/3 [00:02<00:01,  1.26s/it]Loading checkpoint shards: 100%|██████████| 3/3 [00:03<00:00,  1.08s/it]Loading checkpoint shards: 100%|██████████| 3/3 [00:03<00:00,  1.14s/it]

[1/3] Mistral Text Baseline (upper bound)...
Mistral text:   0%|          | 0/200 [00:00<?, ?it/s]Mistral text:   0%|          | 1/200 [00:00<01:53,  1.76it/s]Mistral text:   1%|          | 2/200 [00:00<01:04,  3.09it/s]Mistral text:   2%|▏         | 3/200 [00:00<00:48,  4.07it/s]Mistral text:   2%|▏         | 4/200 [00:01<00:41,  4.74it/s]Mistral text:   2%|▎         | 5/200 [00:01<00:37,  5.22it/s]Mistral text:   3%|▎         | 6/200 [00:01<00:35,  5.48it/s]Mistral text:   4%|▎         | 7/200 [00:01<00:33,  5.73it/s]Mistral text:   4%|▍         | 8/200 [00:01<00:32,  5.94it/s]Mistral text:   4%|▍         | 9/200 [00:01<00:31,  6.04it/s]Mistral text:   5%|▌         | 10/200 [00:02<00:41,  4.56it/s]Mistral text:   6%|▌         | 11/200 [00:02<00:38,  4.95it/s]Mistral text:   6%|▌         | 12/200 [00:02<00:35,  5.33it/s]Mistral text:   6%|▋         | 13/200 [00:02<00:33,  5.55it/s]Mistral text:   7%|▋         | 14/200 [00:02<00:32,  5.68it/s]Mistral text:   8%|▊         | 15/200 [00:02<00:31,  5.90it/s]Mistral text:   8%|▊         | 16/200 [00:03<00:30,  6.06it/s]Mistral text:   8%|▊         | 17/200 [00:03<00:29,  6.18it/s]Mistral text:   9%|▉         | 18/200 [00:03<00:29,  6.23it/s]Mistral text:  10%|▉         | 19/200 [00:03<00:28,  6.30it/s]Mistral text:  10%|█         | 20/200 [00:03<00:28,  6.36it/s]Mistral text:  10%|█         | 21/200 [00:03<00:27,  6.41it/s]Mistral text:  11%|█         | 22/200 [00:04<00:27,  6.41it/s]Mistral text:  12%|█▏        | 23/200 [00:04<00:28,  6.21it/s]Mistral text:  12%|█▏        | 24/200 [00:04<00:34,  5.08it/s]Mistral text:  12%|█▎        | 25/200 [00:04<00:36,  4.79it/s]Mistral text:  13%|█▎        | 26/200 [00:04<00:33,  5.19it/s]Mistral text:  14%|█▎        | 27/200 [00:05<00:31,  5.47it/s]Mistral text:  14%|█▍        | 28/200 [00:05<00:30,  5.71it/s]Mistral text:  14%|█▍        | 29/200 [00:05<00:28,  5.93it/s]Mistral text:  15%|█▌        | 30/200 [00:05<00:27,  6.09it/s]Mistral text:  16%|█▌        | 31/200 [00:05<00:31,  5.33it/s]Mistral text:  16%|█▌        | 32/200 [00:05<00:30,  5.60it/s]Mistral text:  16%|█▋        | 33/200 [00:06<00:28,  5.82it/s]Mistral text:  17%|█▋        | 34/200 [00:06<00:27,  6.00it/s]Mistral text:  18%|█▊        | 35/200 [00:06<00:26,  6.13it/s]Mistral text:  18%|█▊        | 36/200 [00:06<00:26,  6.23it/s]Mistral text:  18%|█▊        | 37/200 [00:06<00:26,  6.11it/s]Mistral text:  19%|█▉        | 38/200 [00:06<00:31,  5.08it/s]Mistral text:  20%|█▉        | 39/200 [00:07<00:34,  4.65it/s]Mistral text:  20%|██        | 40/200 [00:07<00:32,  4.97it/s]Mistral text:  20%|██        | 41/200 [00:07<00:29,  5.34it/s]Mistral text:  21%|██        | 42/200 [00:07<00:28,  5.64it/s]Mistral text:  22%|██▏       | 43/200 [00:07<00:26,  5.87it/s]Mistral text:  22%|██▏       | 44/200 [00:08<00:25,  6.03it/s]Mistral text:  22%|██▎       | 45/200 [00:08<00:25,  6.16it/s]Mistral text:  23%|██▎       | 46/200 [00:08<00:24,  6.26it/s]Mistral text:  24%|██▎       | 47/200 [00:08<00:24,  6.33it/s]Mistral text:  24%|██▍       | 48/200 [00:08<00:24,  6.26it/s]Mistral text:  24%|██▍       | 49/200 [00:08<00:24,  6.26it/s]Mistral text:  25%|██▌       | 50/200 [00:08<00:23,  6.29it/s]Mistral text:  26%|██▌       | 51/200 [00:09<00:23,  6.34it/s]Mistral text:  26%|██▌       | 52/200 [00:09<00:23,  6.20it/s]Mistral text:  26%|██▋       | 53/200 [00:09<00:31,  4.72it/s]Mistral text:  27%|██▋       | 54/200 [00:09<00:28,  5.07it/s]Mistral text:  28%|██▊       | 55/200 [00:09<00:26,  5.42it/s]Mistral text:  28%|██▊       | 56/200 [00:10<00:25,  5.61it/s]Mistral text:  28%|██▊       | 57/200 [00:10<00:24,  5.76it/s]Mistral text:  29%|██▉       | 58/200 [00:10<00:23,  5.94it/s]Mistral text:  30%|██▉       | 59/200 [00:10<00:23,  6.10it/s]Mistral text:  30%|███       | 60/200 [00:10<00:22,  6.21it/s]Mistral text:  30%|███       | 61/200 [00:10<00:22,  6.30it/s]Mistral text:  31%|███       | 62/200 [00:11<00:21,  6.36it/s]Mistral text:  32%|███▏      | 63/200 [00:11<00:21,  6.39it/s]Mistral text:  32%|███▏      | 64/200 [00:11<00:21,  6.41it/s]Mistral text:  32%|███▎      | 65/200 [00:11<00:21,  6.35it/s]Mistral text:  33%|███▎      | 66/200 [00:11<00:21,  6.19it/s]Mistral text:  34%|███▎      | 67/200 [00:12<00:29,  4.54it/s]Mistral text:  34%|███▍      | 68/200 [00:12<00:27,  4.86it/s]Mistral text:  34%|███▍      | 69/200 [00:12<00:25,  5.18it/s]Mistral text:  35%|███▌      | 70/200 [00:12<00:24,  5.21it/s]Mistral text:  36%|███▌      | 71/200 [00:12<00:24,  5.20it/s]Mistral text:  36%|███▌      | 72/200 [00:12<00:24,  5.17it/s]Mistral text:  36%|███▋      | 73/200 [00:13<00:24,  5.12it/s]Mistral text:  37%|███▋      | 74/200 [00:13<00:24,  5.10it/s]Mistral text:  38%|███▊      | 75/200 [00:13<00:23,  5.22it/s]Mistral text:  38%|███▊      | 76/200 [00:13<00:22,  5.47it/s]Mistral text:  38%|███▊      | 77/200 [00:13<00:21,  5.74it/s]Mistral text:  39%|███▉      | 78/200 [00:14<00:20,  5.94it/s]Mistral text:  40%|███▉      | 79/200 [00:14<00:20,  6.00it/s]Mistral text:  40%|████      | 80/200 [00:14<00:26,  4.59it/s]Mistral text:  40%|████      | 81/200 [00:14<00:24,  4.92it/s]Mistral text:  41%|████      | 82/200 [00:14<00:22,  5.19it/s]Mistral text:  42%|████▏     | 83/200 [00:14<00:21,  5.50it/s]Mistral text:  42%|████▏     | 84/200 [00:15<00:20,  5.76it/s]Mistral text:  42%|████▎     | 85/200 [00:15<00:19,  5.95it/s]Mistral text:  43%|████▎     | 86/200 [00:15<00:18,  6.10it/s]Mistral text:  44%|████▎     | 87/200 [00:15<00:18,  6.21it/s]Mistral text:  44%|████▍     | 88/200 [00:15<00:17,  6.29it/s]Mistral text:  44%|████▍     | 89/200 [00:15<00:17,  6.35it/s]Mistral text:  45%|████▌     | 90/200 [00:16<00:17,  6.35it/s]Mistral text:  46%|████▌     | 91/200 [00:16<00:17,  6.25it/s]Mistral text:  46%|████▌     | 92/200 [00:16<00:17,  6.29it/s]Mistral text:  46%|████▋     | 93/200 [00:16<00:16,  6.33it/s]Mistral text:  47%|████▋     | 94/200 [00:16<00:20,  5.21it/s]Mistral text:  48%|████▊     | 95/200 [00:17<00:21,  4.89it/s]Mistral text:  48%|████▊     | 96/200 [00:17<00:19,  5.28it/s]Mistral text:  48%|████▊     | 97/200 [00:17<00:18,  5.57it/s]Mistral text:  49%|████▉     | 98/200 [00:17<00:17,  5.70it/s]Mistral text:  50%|████▉     | 99/200 [00:17<00:17,  5.85it/s]Mistral text:  50%|█████     | 100/200 [00:17<00:16,  6.02it/s]Mistral text:  50%|█████     | 101/200 [00:18<00:16,  6.15it/s]Mistral text:  51%|█████     | 102/200 [00:18<00:15,  6.24it/s]Mistral text:  52%|█████▏    | 103/200 [00:18<00:15,  6.31it/s]Mistral text:  52%|█████▏    | 104/200 [00:18<00:15,  6.37it/s]Mistral text:  52%|█████▎    | 105/200 [00:18<00:14,  6.41it/s]Mistral text:  53%|█████▎    | 106/200 [00:18<00:14,  6.45it/s]Mistral text:  54%|█████▎    | 107/200 [00:18<00:14,  6.38it/s]Mistral text:  54%|█████▍    | 108/200 [00:19<00:15,  5.76it/s]Mistral text:  55%|█████▍    | 109/200 [00:19<00:19,  4.66it/s]Mistral text:  55%|█████▌    | 110/200 [00:19<00:17,  5.02it/s]Mistral text:  56%|█████▌    | 111/200 [00:19<00:16,  5.38it/s]Mistral text:  56%|█████▌    | 112/200 [00:19<00:15,  5.67it/s]Mistral text:  56%|█████▋    | 113/200 [00:20<00:14,  5.89it/s]Mistral text:  57%|█████▋    | 114/200 [00:20<00:14,  6.06it/s]Mistral text:  57%|█████▊    | 115/200 [00:20<00:13,  6.15it/s]Mistral text:  58%|█████▊    | 116/200 [00:20<00:13,  6.02it/s]Mistral text:  58%|█████▊    | 117/200 [00:20<00:13,  6.10it/s]Mistral text:  59%|█████▉    | 118/200 [00:20<00:13,  6.21it/s]Mistral text:  60%|█████▉    | 119/200 [00:21<00:12,  6.30it/s]Mistral text:  60%|██████    | 120/200 [00:21<00:12,  6.35it/s]Mistral text:  60%|██████    | 121/200 [00:21<00:12,  6.39it/s]Mistral text:  61%|██████    | 122/200 [00:21<00:12,  6.38it/s]Mistral text:  62%|██████▏   | 123/200 [00:21<00:14,  5.23it/s]Mistral text:  62%|██████▏   | 124/200 [00:22<00:15,  4.79it/s]Mistral text:  62%|██████▎   | 125/200 [00:22<00:14,  5.17it/s]Mistral text:  63%|██████▎   | 126/200 [00:22<00:13,  5.50it/s]Mistral text:  64%|██████▎   | 127/200 [00:22<00:12,  5.77it/s]Mistral text:  64%|██████▍   | 128/200 [00:22<00:12,  5.97it/s]Mistral text:  64%|██████▍   | 129/200 [00:22<00:11,  6.13it/s]Mistral text:  65%|██████▌   | 130/200 [00:22<00:11,  6.23it/s]Mistral text:  66%|██████▌   | 131/200 [00:23<00:11,  6.20it/s]Mistral text:  66%|██████▌   | 132/200 [00:23<00:11,  6.05it/s]Mistral text:  66%|██████▋   | 133/200 [00:23<00:11,  5.95it/s]Mistral text:  67%|██████▋   | 134/200 [00:23<00:10,  6.03it/s]Mistral text:  68%|██████▊   | 135/200 [00:23<00:10,  6.11it/s]Mistral text:  68%|██████▊   | 136/200 [00:23<00:10,  6.21it/s]Mistral text:  68%|██████▊   | 137/200 [00:24<00:10,  5.79it/s]Mistral text:  69%|██████▉   | 138/200 [00:24<00:13,  4.64it/s]Mistral text:  70%|██████▉   | 139/200 [00:24<00:12,  5.01it/s]Mistral text:  70%|███████   | 140/200 [00:24<00:11,  5.28it/s]Mistral text:  70%|███████   | 141/200 [00:24<00:10,  5.42it/s]Mistral text:  71%|███████   | 142/200 [00:25<00:10,  5.54it/s]Mistral text:  72%|███████▏  | 143/200 [00:25<00:10,  5.64it/s]Mistral text:  72%|███████▏  | 144/200 [00:25<00:09,  5.82it/s]Mistral text:  72%|███████▎  | 145/200 [00:25<00:09,  6.01it/s]Mistral text:  73%|███████▎  | 146/200 [00:25<00:08,  6.15it/s]Mistral text:  74%|███████▎  | 147/200 [00:25<00:08,  6.22it/s]Mistral text:  74%|███████▍  | 148/200 [00:26<00:08,  6.30it/s]Mistral text:  74%|███████▍  | 149/200 [00:26<00:08,  6.28it/s]Mistral text:  75%|███████▌  | 150/200 [00:26<00:08,  6.11it/s]Mistral text:  76%|███████▌  | 151/200 [00:26<00:08,  5.99it/s]Mistral text:  76%|███████▌  | 152/200 [00:26<00:10,  4.64it/s]Mistral text:  76%|███████▋  | 153/200 [00:27<00:09,  5.01it/s]Mistral text:  77%|███████▋  | 154/200 [00:27<00:08,  5.37it/s]Mistral text:  78%|███████▊  | 155/200 [00:27<00:07,  5.64it/s]Mistral text:  78%|███████▊  | 156/200 [00:27<00:07,  5.87it/s]Mistral text:  78%|███████▊  | 157/200 [00:27<00:07,  6.04it/s]Mistral text:  79%|███████▉  | 158/200 [00:27<00:07,  5.97it/s]Mistral text:  80%|███████▉  | 159/200 [00:28<00:06,  5.90it/s]Mistral text:  80%|████████  | 160/200 [00:28<00:06,  6.05it/s]Mistral text:  80%|████████  | 161/200 [00:28<00:06,  6.17it/s]Mistral text:  81%|████████  | 162/200 [00:28<00:06,  6.25it/s]Mistral text:  82%|████████▏ | 163/200 [00:28<00:05,  6.31it/s]Mistral text:  82%|████████▏ | 164/200 [00:28<00:05,  6.36it/s]Mistral text:  82%|████████▎ | 165/200 [00:28<00:05,  6.36it/s]Mistral text:  83%|████████▎ | 166/200 [00:29<00:07,  4.59it/s]Mistral text:  84%|████████▎ | 167/200 [00:29<00:06,  4.76it/s]Mistral text:  84%|████████▍ | 168/200 [00:29<00:06,  5.07it/s]Mistral text:  84%|████████▍ | 169/200 [00:29<00:05,  5.38it/s]Mistral text:  85%|████████▌ | 170/200 [00:30<00:05,  5.65it/s]Mistral text:  86%|████████▌ | 171/200 [00:30<00:04,  5.85it/s]Mistral text:  86%|████████▌ | 172/200 [00:30<00:04,  5.92it/s]Mistral text:  86%|████████▋ | 173/200 [00:30<00:04,  5.94it/s]Mistral text:  87%|████████▋ | 174/200 [00:30<00:04,  6.03it/s]Mistral text:  88%|████████▊ | 175/200 [00:30<00:04,  5.89it/s]Mistral text:  88%|████████▊ | 176/200 [00:31<00:04,  5.54it/s]Mistral text:  88%|████████▊ | 177/200 [00:31<00:04,  5.39it/s]Mistral text:  89%|████████▉ | 178/200 [00:31<00:04,  5.47it/s]Mistral text:  90%|████████▉ | 179/200 [00:31<00:04,  4.71it/s]Mistral text:  90%|█████████ | 180/200 [00:31<00:04,  4.53it/s]Mistral text:  90%|█████████ | 181/200 [00:32<00:03,  4.96it/s]Mistral text:  91%|█████████ | 182/200 [00:32<00:03,  5.16it/s]Mistral text:  92%|█████████▏| 183/200 [00:32<00:03,  5.35it/s]Mistral text:  92%|█████████▏| 184/200 [00:32<00:02,  5.42it/s]Mistral text:  92%|█████████▎| 185/200 [00:32<00:02,  5.58it/s]Mistral text:  93%|█████████▎| 186/200 [00:32<00:02,  5.77it/s]Mistral text:  94%|█████████▎| 187/200 [00:33<00:02,  5.96it/s]Mistral text:  94%|█████████▍| 188/200 [00:33<00:01,  6.10it/s]Mistral text:  94%|█████████▍| 189/200 [00:33<00:01,  6.20it/s]Mistral text:  95%|█████████▌| 190/200 [00:33<00:01,  6.25it/s]Mistral text:  96%|█████████▌| 191/200 [00:33<00:01,  6.30it/s]Mistral text:  96%|█████████▌| 192/200 [00:33<00:01,  6.23it/s]Mistral text:  96%|█████████▋| 193/200 [00:34<00:01,  4.38it/s]Mistral text:  97%|█████████▋| 194/200 [00:34<00:01,  4.73it/s]Mistral text:  98%|█████████▊| 195/200 [00:34<00:00,  5.13it/s]Mistral text:  98%|█████████▊| 196/200 [00:34<00:00,  5.45it/s]Mistral text:  98%|█████████▊| 197/200 [00:34<00:00,  5.63it/s]Mistral text:  99%|█████████▉| 198/200 [00:35<00:00,  5.84it/s]Mistral text: 100%|█████████▉| 199/200 [00:35<00:00,  5.94it/s]Mistral text: 100%|██████████| 200/200 [00:35<00:00,  5.85it/s]Mistral text: 100%|██████████| 200/200 [00:35<00:00,  5.65it/s]
  Mistral text accuracy: 187/200 (93.5%)

[2/3] Noise Baseline (random soft tokens)...
Noise baseline:   0%|          | 0/200 [00:00<?, ?it/s]Noise baseline:   0%|          | 1/200 [00:00<00:41,  4.80it/s]Noise baseline:   1%|          | 2/200 [00:00<00:39,  5.04it/s]Noise baseline:   2%|▏         | 3/200 [00:00<00:35,  5.59it/s]Noise baseline:   2%|▏         | 4/200 [00:00<00:33,  5.89it/s]Noise baseline:   2%|▎         | 5/200 [00:00<00:32,  6.03it/s]Noise baseline:   3%|▎         | 6/200 [00:01<00:39,  4.88it/s]Noise baseline:   4%|▎         | 7/200 [00:01<00:43,  4.45it/s]Noise baseline:   4%|▍         | 8/200 [00:01<00:39,  4.81it/s]Noise baseline:   4%|▍         | 9/200 [00:01<00:37,  5.16it/s]Noise baseline:   5%|▌         | 10/200 [00:01<00:34,  5.45it/s]Noise baseline:   6%|▌         | 11/200 [00:02<00:33,  5.69it/s]Noise baseline:   6%|▌         | 12/200 [00:02<00:31,  5.89it/s]Noise baseline:   6%|▋         | 13/200 [00:02<00:30,  6.04it/s]Noise baseline:   7%|▋         | 14/200 [00:02<00:30,  6.14it/s]Noise baseline:   8%|▊         | 15/200 [00:02<00:29,  6.20it/s]Noise baseline:   8%|▊         | 16/200 [00:02<00:29,  6.24it/s]Noise baseline:   8%|▊         | 17/200 [00:03<00:29,  6.27it/s]Noise baseline:   9%|▉         | 18/200 [00:03<00:30,  6.02it/s]Noise baseline:  10%|▉         | 19/200 [00:03<00:30,  5.97it/s]Noise baseline:  10%|█         | 20/200 [00:03<00:36,  4.91it/s]Noise baseline:  11%|█         | 22/200 [00:03<00:30,  5.89it/s]Noise baseline:  12%|█▏        | 23/200 [00:04<00:29,  5.98it/s]Noise baseline:  12%|█▏        | 24/200 [00:04<00:29,  6.05it/s]Noise baseline:  12%|█▎        | 25/200 [00:04<00:28,  6.11it/s]Noise baseline:  13%|█▎        | 26/200 [00:04<00:28,  6.13it/s]Noise baseline:  14%|█▎        | 27/200 [00:04<00:28,  6.00it/s]Noise baseline:  14%|█▍        | 28/200 [00:04<00:28,  6.03it/s]Noise baseline:  14%|█▍        | 29/200 [00:05<00:28,  6.01it/s]Noise baseline:  15%|█▌        | 30/200 [00:05<00:28,  6.05it/s]Noise baseline:  16%|█▌        | 31/200 [00:05<00:27,  6.10it/s]Noise baseline:  16%|█▌        | 32/200 [00:05<00:27,  6.20it/s]Noise baseline:  16%|█▋        | 33/200 [00:05<00:26,  6.28it/s]Noise baseline:  17%|█▋        | 34/200 [00:05<00:26,  6.34it/s]Noise baseline:  18%|█▊        | 35/200 [00:06<00:27,  5.90it/s]Noise baseline:  18%|█▊        | 36/200 [00:06<00:35,  4.67it/s]Noise baseline:  18%|█▊        | 37/200 [00:06<00:32,  5.05it/s]Noise baseline:  19%|█▉        | 38/200 [00:06<00:29,  5.41it/s]Noise baseline:  20%|█▉        | 39/200 [00:06<00:28,  5.69it/s]Noise baseline:  20%|██        | 40/200 [00:06<00:27,  5.91it/s]Noise baseline:  20%|██        | 41/200 [00:07<00:26,  6.07it/s]Noise baseline:  21%|██        | 42/200 [00:07<00:25,  6.20it/s]Noise baseline:  22%|██▏       | 43/200 [00:07<00:24,  6.29it/s]Noise baseline:  22%|██▏       | 44/200 [00:07<00:25,  6.10it/s]Noise baseline:  22%|██▎       | 45/200 [00:07<00:26,  5.74it/s]Noise baseline:  23%|██▎       | 46/200 [00:08<00:28,  5.48it/s]Noise baseline:  24%|██▎       | 47/200 [00:08<00:27,  5.49it/s]Noise baseline:  24%|██▍       | 48/200 [00:08<00:26,  5.71it/s]Noise baseline:  24%|██▍       | 49/200 [00:08<00:34,  4.38it/s]Noise baseline:  25%|██▌       | 50/200 [00:08<00:31,  4.73it/s]Noise baseline:  26%|██▌       | 51/200 [00:09<00:29,  5.11it/s]Noise baseline:  26%|██▌       | 52/200 [00:09<00:27,  5.45it/s]Noise baseline:  26%|██▋       | 53/200 [00:09<00:25,  5.70it/s]Noise baseline:  27%|██▋       | 54/200 [00:09<00:25,  5.80it/s]Noise baseline:  28%|██▊       | 55/200 [00:09<00:24,  5.92it/s]Noise baseline:  28%|██▊       | 56/200 [00:09<00:23,  6.05it/s]Noise baseline:  28%|██▊       | 57/200 [00:09<00:23,  6.17it/s]Noise baseline:  29%|██▉       | 58/200 [00:10<00:22,  6.23it/s]Noise baseline:  30%|██▉       | 59/200 [00:10<00:22,  6.28it/s]Noise baseline:  30%|███       | 60/200 [00:10<00:22,  6.30it/s]Noise baseline:  30%|███       | 61/200 [00:10<00:21,  6.32it/s]Noise baseline:  31%|███       | 62/200 [00:10<00:21,  6.36it/s]Noise baseline:  32%|███▏      | 63/200 [00:11<00:30,  4.50it/s]Noise baseline:  32%|███▏      | 64/200 [00:11<00:28,  4.78it/s]Noise baseline:  32%|███▎      | 65/200 [00:11<00:26,  5.17it/s]Noise baseline:  33%|███▎      | 66/200 [00:11<00:24,  5.50it/s]Noise baseline:  34%|███▎      | 67/200 [00:11<00:23,  5.76it/s]Noise baseline:  34%|███▍      | 68/200 [00:11<00:22,  5.95it/s]Noise baseline:  34%|███▍      | 69/200 [00:12<00:21,  5.99it/s]Noise baseline:  35%|███▌      | 70/200 [00:12<00:21,  6.10it/s]Noise baseline:  36%|███▌      | 71/200 [00:12<00:20,  6.19it/s]Noise baseline:  36%|███▌      | 72/200 [00:12<00:20,  6.11it/s]Noise baseline:  36%|███▋      | 73/200 [00:12<00:21,  6.03it/s]Noise baseline:  37%|███▋      | 74/200 [00:12<00:20,  6.12it/s]Noise baseline:  38%|███▊      | 75/200 [00:13<00:20,  6.17it/s]Noise baseline:  38%|███▊      | 76/200 [00:13<00:19,  6.24it/s]Noise baseline:  38%|███▊      | 77/200 [00:13<00:26,  4.63it/s]Noise baseline:  39%|███▉      | 78/200 [00:13<00:24,  4.98it/s]Noise baseline:  40%|███▉      | 79/200 [00:13<00:22,  5.34it/s]Noise baseline:  40%|████      | 80/200 [00:14<00:21,  5.63it/s]Noise baseline:  40%|████      | 81/200 [00:14<00:20,  5.71it/s]Noise baseline:  41%|████      | 82/200 [00:14<00:20,  5.70it/s]Noise baseline:  42%|████▏     | 83/200 [00:14<00:19,  5.89it/s]Noise baseline:  42%|████▏     | 84/200 [00:14<00:19,  6.05it/s]Noise baseline:  42%|████▎     | 85/200 [00:14<00:18,  6.18it/s]Noise baseline:  43%|████▎     | 86/200 [00:15<00:18,  6.27it/s]Noise baseline:  44%|████▎     | 87/200 [00:15<00:17,  6.34it/s]Noise baseline:  44%|████▍     | 88/200 [00:15<00:17,  6.37it/s]Noise baseline:  44%|████▍     | 89/200 [00:15<00:17,  6.40it/s]Noise baseline:  45%|████▌     | 90/200 [00:15<00:17,  6.34it/s]Noise baseline:  46%|████▌     | 91/200 [00:15<00:18,  5.90it/s]Noise baseline:  46%|████▌     | 92/200 [00:16<00:23,  4.63it/s]Noise baseline:  46%|████▋     | 93/200 [00:16<00:21,  4.99it/s]Noise baseline:  47%|████▋     | 94/200 [00:16<00:19,  5.35it/s]Noise baseline:  48%|████▊     | 95/200 [00:16<00:18,  5.65it/s]Noise baseline:  48%|████▊     | 96/200 [00:16<00:17,  5.86it/s]Noise baseline:  48%|████▊     | 97/200 [00:16<00:17,  6.03it/s]Noise baseline:  49%|████▉     | 98/200 [00:17<00:16,  6.13it/s]Noise baseline:  50%|████▉     | 99/200 [00:17<00:16,  6.11it/s]Noise baseline:  50%|█████     | 100/200 [00:17<00:16,  6.15it/s]Noise baseline:  50%|█████     | 101/200 [00:17<00:15,  6.22it/s]Noise baseline:  51%|█████     | 102/200 [00:17<00:15,  6.27it/s]Noise baseline:  52%|█████▏    | 103/200 [00:17<00:15,  6.32it/s]Noise baseline:  52%|█████▏    | 104/200 [00:18<00:15,  6.36it/s]Noise baseline:  52%|█████▎    | 105/200 [00:18<00:14,  6.39it/s]Noise baseline:  53%|█████▎    | 106/200 [00:18<00:18,  5.21it/s]Noise baseline:  54%|█████▎    | 107/200 [00:18<00:19,  4.88it/s]Noise baseline:  54%|█████▍    | 108/200 [00:18<00:17,  5.19it/s]Noise baseline:  55%|█████▍    | 109/200 [00:19<00:16,  5.47it/s]Noise baseline:  55%|█████▌    | 110/200 [00:19<00:15,  5.74it/s]Noise baseline:  56%|█████▌    | 111/200 [00:19<00:14,  5.95it/s]Noise baseline:  56%|█████▌    | 112/200 [00:19<00:14,  6.11it/s]Noise baseline:  56%|█████▋    | 113/200 [00:19<00:13,  6.22it/s]Noise baseline:  57%|█████▋    | 114/200 [00:19<00:13,  6.31it/s]Noise baseline:  57%|█████▊    | 115/200 [00:19<00:13,  6.36it/s]Noise baseline:  58%|█████▊    | 116/200 [00:20<00:13,  6.39it/s]Noise baseline:  58%|█████▊    | 117/200 [00:20<00:13,  6.31it/s]Noise baseline:  59%|█████▉    | 118/200 [00:20<00:13,  6.26it/s]Noise baseline:  60%|█████▉    | 119/200 [00:20<00:12,  6.31it/s]Noise baseline:  60%|██████    | 120/200 [00:20<00:15,  5.16it/s]Noise baseline:  60%|██████    | 121/200 [00:21<00:16,  4.86it/s]Noise baseline:  61%|██████    | 122/200 [00:21<00:14,  5.25it/s]Noise baseline:  62%|██████▏   | 123/200 [00:21<00:13,  5.57it/s]Noise baseline:  62%|██████▏   | 124/200 [00:21<00:13,  5.82it/s]Noise baseline:  62%|██████▎   | 125/200 [00:21<00:12,  5.97it/s]Noise baseline:  63%|██████▎   | 126/200 [00:21<00:12,  5.98it/s]Noise baseline:  64%|██████▎   | 127/200 [00:22<00:11,  6.10it/s]Noise baseline:  64%|██████▍   | 128/200 [00:22<00:11,  6.22it/s]Noise baseline:  64%|██████▍   | 129/200 [00:22<00:11,  6.30it/s]Noise baseline:  65%|██████▌   | 130/200 [00:22<00:11,  6.35it/s]Noise baseline:  66%|██████▌   | 131/200 [00:22<00:10,  6.39it/s]Noise baseline:  66%|██████▌   | 132/200 [00:22<00:10,  6.42it/s]Noise baseline:  66%|██████▋   | 133/200 [00:22<00:10,  6.45it/s]Noise baseline:  67%|██████▋   | 134/200 [00:23<00:10,  6.39it/s]Noise baseline:  68%|██████▊   | 135/200 [00:23<00:14,  4.62it/s]Noise baseline:  68%|██████▊   | 136/200 [00:23<00:12,  4.99it/s]Noise baseline:  69%|██████▉   | 138/200 [00:23<00:09,  6.34it/s]Noise baseline:  70%|██████▉   | 139/200 [00:24<00:09,  6.37it/s]Noise baseline:  70%|███████   | 140/200 [00:24<00:09,  6.40it/s]Noise baseline:  70%|███████   | 141/200 [00:24<00:09,  6.43it/s]Noise baseline:  71%|███████   | 142/200 [00:24<00:08,  6.44it/s]Noise baseline:  72%|███████▏  | 143/200 [00:24<00:08,  6.45it/s]Noise baseline:  72%|███████▏  | 144/200 [00:24<00:08,  6.33it/s]Noise baseline:  72%|███████▎  | 145/200 [00:24<00:08,  6.31it/s]Noise baseline:  73%|███████▎  | 146/200 [00:25<00:08,  6.34it/s]Noise baseline:  74%|███████▎  | 147/200 [00:25<00:08,  6.38it/s]Noise baseline:  74%|███████▍  | 148/200 [00:25<00:08,  6.41it/s]Noise baseline:  74%|███████▍  | 149/200 [00:25<00:07,  6.42it/s]Noise baseline:  75%|███████▌  | 150/200 [00:25<00:10,  4.72it/s]Noise baseline:  76%|███████▌  | 151/200 [00:26<00:09,  5.04it/s]Noise baseline:  76%|███████▌  | 152/200 [00:26<00:09,  5.25it/s]Noise baseline:  76%|███████▋  | 153/200 [00:26<00:08,  5.53it/s]Noise baseline:  77%|███████▋  | 154/200 [00:26<00:07,  5.79it/s]Noise baseline:  78%|███████▊  | 155/200 [00:26<00:07,  5.98it/s]Noise baseline:  78%|███████▊  | 156/200 [00:26<00:07,  6.08it/s]Noise baseline:  78%|███████▊  | 157/200 [00:27<00:06,  6.15it/s]Noise baseline:  79%|███████▉  | 158/200 [00:27<00:06,  6.25it/s]Noise baseline:  80%|███████▉  | 159/200 [00:27<00:06,  6.28it/s]Noise baseline:  80%|████████  | 160/200 [00:27<00:06,  6.33it/s]Noise baseline:  80%|████████  | 161/200 [00:27<00:06,  6.06it/s]Noise baseline:  81%|████████  | 162/200 [00:27<00:06,  5.85it/s]Noise baseline:  82%|████████▏ | 163/200 [00:28<00:06,  5.46it/s]Noise baseline:  82%|████████▏ | 164/200 [00:28<00:08,  4.43it/s]Noise baseline:  82%|████████▎ | 165/200 [00:28<00:07,  4.89it/s]Noise baseline:  83%|████████▎ | 166/200 [00:28<00:06,  5.28it/s]Noise baseline:  84%|████████▎ | 167/200 [00:28<00:05,  5.60it/s]Noise baseline:  84%|████████▍ | 168/200 [00:29<00:05,  5.85it/s]Noise baseline:  84%|████████▍ | 169/200 [00:29<00:05,  5.99it/s]Noise baseline:  85%|████████▌ | 170/200 [00:29<00:04,  6.01it/s]Noise baseline:  86%|████████▌ | 171/200 [00:29<00:04,  6.12it/s]Noise baseline:  86%|████████▌ | 172/200 [00:29<00:04,  6.20it/s]Noise baseline:  86%|████████▋ | 173/200 [00:29<00:04,  6.28it/s]Noise baseline:  87%|████████▋ | 174/200 [00:29<00:04,  6.34it/s]Noise baseline:  88%|████████▊ | 175/200 [00:30<00:04,  6.18it/s]Noise baseline:  88%|████████▊ | 176/200 [00:30<00:04,  5.47it/s]Noise baseline:  88%|████████▊ | 177/200 [00:30<00:04,  4.76it/s]Noise baseline:  89%|████████▉ | 178/200 [00:30<00:04,  4.56it/s]Noise baseline:  90%|████████▉ | 179/200 [00:31<00:04,  5.00it/s]Noise baseline:  90%|█████████ | 180/200 [00:31<00:03,  5.37it/s]Noise baseline:  90%|█████████ | 181/200 [00:31<00:03,  5.52it/s]Noise baseline:  91%|█████████ | 182/200 [00:31<00:03,  5.78it/s]Noise baseline:  92%|█████████▏| 183/200 [00:31<00:02,  5.98it/s]Noise baseline:  92%|█████████▏| 184/200 [00:31<00:02,  6.13it/s]Noise baseline:  92%|█████████▎| 185/200 [00:32<00:02,  6.19it/s]Noise baseline:  93%|█████████▎| 186/200 [00:32<00:02,  6.06it/s]Noise baseline:  94%|█████████▎| 187/200 [00:32<00:02,  6.29it/s]Noise baseline:  94%|█████████▍| 188/200 [00:32<00:01,  6.34it/s]Noise baseline:  94%|█████████▍| 189/200 [00:32<00:01,  6.38it/s]Noise baseline:  95%|█████████▌| 190/200 [00:32<00:01,  6.36it/s]Noise baseline:  96%|█████████▌| 191/200 [00:32<00:01,  6.18it/s]Noise baseline:  96%|█████████▌| 192/200 [00:33<00:01,  4.69it/s]Noise baseline:  96%|█████████▋| 193/200 [00:33<00:01,  5.07it/s]Noise baseline:  97%|█████████▋| 194/200 [00:33<00:01,  5.23it/s]Noise baseline:  98%|█████████▊| 195/200 [00:33<00:00,  5.37it/s]Noise baseline:  98%|█████████▊| 196/200 [00:33<00:00,  5.66it/s]Noise baseline:  98%|█████████▊| 197/200 [00:34<00:00,  5.89it/s]Noise baseline:  99%|█████████▉| 198/200 [00:34<00:00,  6.03it/s]Noise baseline: 100%|█████████▉| 199/200 [00:34<00:00,  6.17it/s]Noise baseline: 100%|██████████| 200/200 [00:34<00:00,  6.26it/s]Noise baseline: 100%|██████████| 200/200 [00:34<00:00,  5.78it/s]
  Noise accuracy: 0/200 (0.0%)

Loading Llama...
Downloading shards:   0%|          | 0/4 [00:00<?, ?it/s]Downloading shards: 100%|██████████| 4/4 [00:00<00:00, 3986.03it/s]
Loading checkpoint shards:   0%|          | 0/4 [00:00<?, ?it/s]Loading checkpoint shards:  25%|██▌       | 1/4 [00:01<00:03,  1.30s/it]Loading checkpoint shards:  50%|█████     | 2/4 [00:02<00:02,  1.13s/it]Loading checkpoint shards:  75%|███████▌  | 3/4 [00:03<00:01,  1.15s/it]Loading checkpoint shards: 100%|██████████| 4/4 [00:03<00:00,  1.23it/s]Loading checkpoint shards: 100%|██████████| 4/4 [00:03<00:00,  1.06it/s]

[3/3] Llama Text Baseline...
Llama text:   0%|          | 0/200 [00:00<?, ?it/s]/users/sujinesh/.local/lib/python3.10/site-packages/transformers/generation/configuration_utils.py:590: UserWarning: `do_sample` is set to `False`. However, `temperature` is set to `0.6` -- this flag is only used in sample-based generation modes. You should set `do_sample=True` or unset `temperature`.
  warnings.warn(
/users/sujinesh/.local/lib/python3.10/site-packages/transformers/generation/configuration_utils.py:595: UserWarning: `do_sample` is set to `False`. However, `top_p` is set to `0.9` -- this flag is only used in sample-based generation modes. You should set `do_sample=True` or unset `top_p`.
  warnings.warn(
Llama text:   0%|          | 1/200 [00:00<00:26,  7.39it/s]Llama text:   1%|          | 2/200 [00:00<00:25,  7.68it/s]Llama text:   2%|▏         | 3/200 [00:00<00:25,  7.68it/s]Llama text:   2%|▏         | 4/200 [00:00<00:25,  7.57it/s]Llama text:   2%|▎         | 5/200 [00:00<00:25,  7.64it/s]Llama text:   3%|▎         | 6/200 [00:00<00:25,  7.71it/s]Llama text:   4%|▎         | 7/200 [00:00<00:24,  7.75it/s]Llama text:   4%|▍         | 8/200 [00:01<00:31,  6.03it/s]Llama text:   4%|▍         | 9/200 [00:01<00:34,  5.59it/s]Llama text:   5%|▌         | 10/200 [00:01<00:30,  6.13it/s]Llama text:   6%|▌         | 11/200 [00:01<00:28,  6.58it/s]Llama text:   6%|▌         | 12/200 [00:01<00:27,  6.92it/s]Llama text:   6%|▋         | 13/200 [00:01<00:26,  7.06it/s]Llama text:   7%|▋         | 14/200 [00:02<00:25,  7.17it/s]Llama text:   8%|▊         | 15/200 [00:02<00:25,  7.13it/s]Llama text:   8%|▊         | 16/200 [00:02<00:26,  6.93it/s]Llama text:   8%|▊         | 17/200 [00:02<00:27,  6.77it/s]Llama text:   9%|▉         | 18/200 [00:02<00:27,  6.63it/s]Llama text:  10%|▉         | 19/200 [00:02<00:27,  6.58it/s]Llama text:  10%|█         | 20/200 [00:02<00:26,  6.76it/s]Llama text:  10%|█         | 21/200 [00:03<00:25,  7.06it/s]Llama text:  11%|█         | 22/200 [00:03<00:24,  7.22it/s]Llama text:  12%|█▏        | 23/200 [00:03<00:23,  7.40it/s]Llama text:  12%|█▏        | 24/200 [00:03<00:31,  5.64it/s]Llama text:  12%|█▎        | 25/200 [00:03<00:32,  5.43it/s]Llama text:  13%|█▎        | 26/200 [00:03<00:29,  5.90it/s]Llama text:  14%|█▎        | 27/200 [00:04<00:27,  6.38it/s]Llama text:  14%|█▍        | 28/200 [00:04<00:25,  6.72it/s]Llama text:  14%|█▍        | 29/200 [00:04<00:24,  7.04it/s]Llama text:  15%|█▌        | 30/200 [00:04<00:23,  7.27it/s]Llama text:  16%|█▌        | 31/200 [00:04<00:22,  7.46it/s]Llama text:  16%|█▌        | 32/200 [00:04<00:22,  7.59it/s]Llama text:  16%|█▋        | 33/200 [00:04<00:21,  7.64it/s]Llama text:  17%|█▋        | 34/200 [00:04<00:22,  7.42it/s]Llama text:  18%|█▊        | 35/200 [00:05<00:22,  7.34it/s]Llama text:  18%|█▊        | 36/200 [00:05<00:22,  7.34it/s]Llama text:  18%|█▊        | 37/200 [00:05<00:22,  7.38it/s]Llama text:  19%|█▉        | 38/200 [00:05<00:21,  7.52it/s]Llama text:  20%|█▉        | 39/200 [00:05<00:21,  7.63it/s]Llama text:  20%|██        | 40/200 [00:05<00:20,  7.71it/s]Llama text:  20%|██        | 41/200 [00:05<00:21,  7.25it/s]Llama text:  21%|██        | 42/200 [00:06<00:28,  5.49it/s]Llama text:  22%|██▏       | 43/200 [00:06<00:26,  5.94it/s]Llama text:  22%|██▏       | 44/200 [00:06<00:24,  6.30it/s]Llama text:  22%|██▎       | 45/200 [00:06<00:23,  6.59it/s]Llama text:  23%|██▎       | 46/200 [00:06<00:22,  6.93it/s]Llama text:  24%|██▎       | 47/200 [00:06<00:21,  7.18it/s]Llama text:  24%|██▍       | 48/200 [00:06<00:20,  7.37it/s]Llama text:  24%|██▍       | 49/200 [00:07<00:20,  7.52it/s]Llama text:  25%|██▌       | 50/200 [00:07<00:19,  7.62it/s]Llama text:  26%|██▌       | 51/200 [00:07<00:19,  7.71it/s]Llama text:  26%|██▌       | 52/200 [00:07<00:19,  7.75it/s]Llama text:  26%|██▋       | 53/200 [00:07<00:18,  7.79it/s]Llama text:  27%|██▋       | 54/200 [00:07<00:18,  7.82it/s]Llama text:  28%|██▊       | 55/200 [00:07<00:18,  7.71it/s]Llama text:  28%|██▊       | 56/200 [00:08<00:18,  7.61it/s]Llama text:  28%|██▊       | 57/200 [00:08<00:18,  7.68it/s]Llama text:  29%|██▉       | 58/200 [00:08<00:18,  7.72it/s]Llama text:  30%|██▉       | 59/200 [00:08<00:23,  6.10it/s]Llama text:  30%|███       | 60/200 [00:08<00:24,  5.68it/s]Llama text:  30%|███       | 61/200 [00:08<00:22,  6.20it/s]Llama text:  31%|███       | 62/200 [00:08<00:20,  6.62it/s]Llama text:  32%|███▏      | 63/200 [00:09<00:19,  6.92it/s]Llama text:  32%|███▏      | 64/200 [00:09<00:18,  7.17it/s]Llama text:  32%|███▎      | 65/200 [00:09<00:18,  7.23it/s]Llama text:  33%|███▎      | 66/200 [00:09<00:18,  7.31it/s]Llama text:  34%|███▎      | 67/200 [00:09<00:17,  7.45it/s]Llama text:  34%|███▍      | 68/200 [00:09<00:17,  7.57it/s]Llama text:  34%|███▍      | 69/200 [00:09<00:17,  7.66it/s]Llama text:  35%|███▌      | 70/200 [00:09<00:16,  7.72it/s]Llama text:  36%|███▌      | 71/200 [00:10<00:16,  7.77it/s]Llama text:  36%|███▌      | 72/200 [00:10<00:16,  7.81it/s]Llama text:  36%|███▋      | 73/200 [00:10<00:16,  7.83it/s]Llama text:  37%|███▋      | 74/200 [00:10<00:16,  7.84it/s]Llama text:  38%|███▊      | 75/200 [00:10<00:15,  7.84it/s]Llama text:  38%|███▊      | 76/200 [00:10<00:17,  7.09it/s]Llama text:  38%|███▊      | 77/200 [00:11<00:22,  5.36it/s]Llama text:  39%|███▉      | 78/200 [00:11<00:21,  5.81it/s]Llama text:  40%|███▉      | 79/200 [00:11<00:19,  6.31it/s]Llama text:  40%|████      | 80/200 [00:11<00:17,  6.70it/s]Llama text:  40%|████      | 81/200 [00:11<00:16,  7.02it/s]Llama text:  41%|████      | 82/200 [00:11<00:16,  7.25it/s]Llama text:  42%|████▏     | 83/200 [00:11<00:15,  7.43it/s]Llama text:  42%|████▏     | 84/200 [00:11<00:15,  7.56it/s]Llama text:  42%|████▎     | 85/200 [00:12<00:15,  7.66it/s]Llama text:  43%|████▎     | 86/200 [00:12<00:15,  7.53it/s]Llama text:  44%|████▎     | 87/200 [00:12<00:15,  7.46it/s]Llama text:  44%|████▍     | 88/200 [00:12<00:14,  7.57it/s]Llama text:  44%|████▍     | 89/200 [00:12<00:14,  7.66it/s]Llama text:  45%|████▌     | 90/200 [00:12<00:14,  7.72it/s]Llama text:  46%|████▌     | 91/200 [00:12<00:14,  7.76it/s]Llama text:  46%|████▌     | 92/200 [00:13<00:13,  7.79it/s]Llama text:  46%|████▋     | 93/200 [00:13<00:13,  7.80it/s]Llama text:  47%|████▋     | 94/200 [00:13<00:17,  6.10it/s]Llama text:  48%|████▊     | 95/200 [00:13<00:18,  5.67it/s]Llama text:  48%|████▊     | 96/200 [00:13<00:16,  6.14it/s]Llama text:  48%|████▊     | 97/200 [00:13<00:15,  6.47it/s]Llama text:  49%|████▉     | 98/200 [00:14<00:15,  6.78it/s]Llama text:  50%|████▉     | 99/200 [00:14<00:14,  7.06it/s]Llama text:  50%|█████     | 100/200 [00:14<00:13,  7.28it/s]Llama text:  50%|█████     | 101/200 [00:14<00:13,  7.44it/s]Llama text:  51%|█████     | 102/200 [00:14<00:12,  7.57it/s]Llama text:  52%|█████▏    | 103/200 [00:14<00:12,  7.66it/s]Llama text:  52%|█████▏    | 104/200 [00:14<00:12,  7.72it/s]Llama text:  52%|█████▎    | 105/200 [00:14<00:12,  7.76it/s]Llama text:  53%|█████▎    | 106/200 [00:15<00:12,  7.75it/s]Llama text:  54%|█████▎    | 107/200 [00:15<00:11,  7.77it/s]Llama text:  54%|█████▍    | 108/200 [00:15<00:12,  7.61it/s]Llama text:  55%|█████▍    | 109/200 [00:15<00:12,  7.50it/s]Llama text:  55%|█████▌    | 110/200 [00:15<00:11,  7.56it/s]Llama text:  56%|█████▌    | 111/200 [00:15<00:11,  7.44it/s]Llama text:  56%|█████▌    | 112/200 [00:15<00:14,  5.98it/s]Llama text:  56%|█████▋    | 113/200 [00:16<00:15,  5.66it/s]Llama text:  57%|█████▋    | 114/200 [00:16<00:14,  6.09it/s]Llama text:  57%|█████▊    | 115/200 [00:16<00:13,  6.54it/s]Llama text:  58%|█████▊    | 116/200 [00:16<00:12,  6.90it/s]Llama text:  58%|█████▊    | 117/200 [00:16<00:11,  7.17it/s]Llama text:  59%|█████▉    | 118/200 [00:16<00:11,  7.35it/s]Llama text:  60%|█████▉    | 119/200 [00:16<00:11,  7.32it/s]Llama text:  60%|██████    | 120/200 [00:17<00:10,  7.34it/s]Llama text:  60%|██████    | 121/200 [00:17<00:10,  7.29it/s]Llama text:  61%|██████    | 122/200 [00:17<00:10,  7.31it/s]Llama text:  62%|██████▏   | 123/200 [00:17<00:10,  7.42it/s]Llama text:  62%|██████▏   | 124/200 [00:17<00:10,  7.55it/s]Llama text:  62%|██████▎   | 125/200 [00:17<00:09,  7.65it/s]Llama text:  63%|██████▎   | 126/200 [00:17<00:09,  7.71it/s]Llama text:  64%|██████▎   | 127/200 [00:17<00:09,  7.76it/s]Llama text:  64%|██████▍   | 128/200 [00:18<00:09,  7.63it/s]Llama text:  64%|██████▍   | 129/200 [00:18<00:10,  6.72it/s]Llama text:  65%|██████▌   | 130/200 [00:18<00:13,  5.15it/s]Llama text:  66%|██████▌   | 131/200 [00:18<00:12,  5.65it/s]Llama text:  66%|██████▌   | 132/200 [00:18<00:11,  6.17it/s]Llama text:  66%|██████▋   | 133/200 [00:18<00:10,  6.60it/s]Llama text:  67%|██████▋   | 134/200 [00:19<00:09,  6.92it/s]Llama text:  68%|██████▊   | 135/200 [00:19<00:09,  7.19it/s]Llama text:  68%|██████▊   | 136/200 [00:19<00:08,  7.39it/s]Llama text:  68%|██████▊   | 137/200 [00:19<00:08,  7.54it/s]Llama text:  69%|██████▉   | 138/200 [00:19<00:08,  7.55it/s]Llama text:  70%|██████▉   | 139/200 [00:19<00:08,  7.43it/s]Llama text:  70%|███████   | 140/200 [00:19<00:08,  7.42it/s]Llama text:  70%|███████   | 141/200 [00:20<00:07,  7.53it/s]Llama text:  71%|███████   | 142/200 [00:20<00:07,  7.62it/s]Llama text:  72%|███████▏  | 143/200 [00:20<00:07,  7.70it/s]Llama text:  72%|███████▏  | 144/200 [00:20<00:07,  7.76it/s]Llama text:  72%|███████▎  | 145/200 [00:20<00:07,  7.74it/s]Llama text:  73%|███████▎  | 146/200 [00:20<00:07,  7.65it/s]Llama text:  74%|███████▎  | 147/200 [00:21<00:10,  5.02it/s]Llama text:  74%|███████▍  | 148/200 [00:21<00:10,  4.94it/s]Llama text:  74%|███████▍  | 149/200 [00:21<00:09,  5.48it/s]Llama text:  75%|███████▌  | 150/200 [00:21<00:08,  6.01it/s]Llama text:  76%|███████▌  | 151/200 [00:21<00:07,  6.47it/s]Llama text:  76%|███████▌  | 152/200 [00:21<00:07,  6.83it/s]Llama text:  76%|███████▋  | 153/200 [00:21<00:06,  7.10it/s]Llama text:  77%|███████▋  | 154/200 [00:22<00:06,  7.04it/s]Llama text:  78%|███████▊  | 155/200 [00:22<00:06,  7.27it/s]Llama text:  78%|███████▊  | 156/200 [00:22<00:05,  7.43it/s]Llama text:  78%|███████▊  | 157/200 [00:22<00:05,  7.56it/s]Llama text:  79%|███████▉  | 158/200 [00:22<00:05,  7.64it/s]Llama text:  80%|███████▉  | 159/200 [00:22<00:05,  7.61it/s]Llama text:  80%|████████  | 160/200 [00:22<00:05,  7.41it/s]Llama text:  80%|████████  | 161/200 [00:22<00:05,  7.46it/s]Llama text:  81%|████████  | 162/200 [00:23<00:05,  7.57it/s]Llama text:  82%|████████▏ | 163/200 [00:23<00:04,  7.64it/s]Llama text:  82%|████████▏ | 164/200 [00:23<00:05,  6.03it/s]Llama text:  82%|████████▎ | 165/200 [00:23<00:06,  5.69it/s]Llama text:  83%|████████▎ | 166/200 [00:23<00:05,  6.13it/s]Llama text:  84%|████████▎ | 167/200 [00:23<00:05,  6.56it/s]Llama text:  84%|████████▍ | 168/200 [00:24<00:04,  6.86it/s]Llama text:  84%|████████▍ | 169/200 [00:24<00:04,  6.90it/s]Llama text:  85%|████████▌ | 170/200 [00:24<00:04,  6.87it/s]Llama text:  86%|████████▌ | 171/200 [00:24<00:04,  7.01it/s]Llama text:  86%|████████▌ | 172/200 [00:24<00:03,  7.20it/s]Llama text:  86%|████████▋ | 173/200 [00:24<00:03,  7.37it/s]Llama text:  87%|████████▋ | 174/200 [00:24<00:03,  7.51it/s]Llama text:  88%|████████▊ | 175/200 [00:24<00:03,  7.62it/s]Llama text:  88%|████████▊ | 176/200 [00:25<00:03,  7.69it/s]Llama text:  88%|████████▊ | 177/200 [00:25<00:02,  7.74it/s]Llama text:  89%|████████▉ | 178/200 [00:25<00:02,  7.78it/s]Llama text:  90%|████████▉ | 179/200 [00:25<00:02,  7.82it/s]Llama text:  90%|█████████ | 180/200 [00:25<00:02,  7.80it/s]Llama text:  90%|█████████ | 181/200 [00:25<00:02,  7.25it/s]Llama text:  91%|█████████ | 182/200 [00:26<00:03,  5.32it/s]Llama text:  92%|█████████▏| 183/200 [00:26<00:02,  5.81it/s]Llama text:  92%|█████████▏| 184/200 [00:26<00:02,  6.30it/s]Llama text:  92%|█████████▎| 185/200 [00:26<00:02,  6.70it/s]Llama text:  93%|█████████▎| 186/200 [00:26<00:01,  7.02it/s]Llama text:  94%|█████████▎| 187/200 [00:26<00:01,  7.26it/s]Llama text:  94%|█████████▍| 188/200 [00:26<00:01,  7.43it/s]Llama text:  94%|█████████▍| 189/200 [00:26<00:01,  7.56it/s]Llama text:  95%|█████████▌| 190/200 [00:27<00:01,  7.48it/s]Llama text:  96%|█████████▌| 191/200 [00:27<00:01,  7.31it/s]Llama text:  96%|█████████▌| 192/200 [00:27<00:01,  7.39it/s]Llama text:  96%|█████████▋| 193/200 [00:27<00:00,  7.50it/s]Llama text:  97%|█████████▋| 194/200 [00:27<00:00,  7.60it/s]Llama text:  98%|█████████▊| 195/200 [00:27<00:00,  7.68it/s]Llama text:  98%|█████████▊| 196/200 [00:27<00:00,  7.73it/s]Llama text:  98%|█████████▊| 197/200 [00:28<00:00,  7.76it/s]Llama text:  99%|█████████▉| 198/200 [00:28<00:00,  7.74it/s]Llama text: 100%|█████████▉| 199/200 [00:28<00:00,  6.08it/s]Llama text: 100%|██████████| 200/200 [00:28<00:00,  5.54it/s]Llama text: 100%|██████████| 200/200 [00:28<00:00,  6.98it/s]
  Llama text accuracy: 178/200 (89.0%)

============================================================
BASELINE SUMMARY
============================================================
  Random:           50.0%
  Majority class:   50.9%
  Noise (random):   0.0%
  Llama text:       89.0%
  Mistral text:     93.5%  <- Upper bound

  Bridge result:    93.46%

GAP to upper bound: 0.0%
  Bridge is near-optimal for this task!
============================================================

Results saved to: runs/sst2_20251203_213431/sst2_baselines.json
